title,context,question_id,question_text,is_impossible,answer_text,answer_start,answer_end
New_York_City,"The New York City Fire Department (FDNY), provides fire protection, technical rescue, primary response to biological, chemical, and radioactive hazards, and emergency medical services for the five boroughs of New York City. The New York City Fire Department is the largest municipal fire department in the United States and the second largest in the world after the Tokyo Fire Department. The FDNY employs approximately 11,080 uniformed firefighters and over 3,300 uniformed EMTs and paramedics. The FDNY's motto is New York's Bravest.",56d1076317492d1400aab78c,What does FDNY stand for?,False,New York City Fire Department,4,33
Cyprus,"Following the death in 1473 of James II, the last Lusignan king, the Republic of Venice assumed control of the island, while the late king's Venetian widow, Queen Catherine Cornaro, reigned as figurehead. Venice formally annexed the Kingdom of Cyprus in 1489, following the abdication of Catherine. The Venetians fortified Nicosia by building the Venetian Walls, and used it as an important commercial hub. Throughout Venetian rule, the Ottoman Empire frequently raided Cyprus. In 1539 the Ottomans destroyed Limassol and so fearing the worst, the Venetians also fortified Famagusta and Kyrenia.",572e7f8003f98919007566df,In what year did the Ottomans destroy Limassol?,False,1539,481,485
Crucifixion_of_Jesus,"Jesus' death and resurrection underpin a variety of theological interpretations as to how salvation is granted to humanity. These interpretations vary widely in how much emphasis they place on the death of Jesus as compared to his words. According to the substitutionary atonement view, Jesus' death is of central importance, and Jesus willingly sacrificed himself as an act of perfect obedience as a sacrifice of love which pleased God. By contrast the moral influence theory of atonement focuses much more on the moral content of Jesus' teaching, and sees Jesus' death as a martyrdom. Since the Middle Ages there has been conflict between these two views within Western Christianity. Evangelical Protestants typically hold a substitutionary view and in particular hold to the theory of penal substitution. Liberal Protestants typically reject substitutionary atonement and hold to the moral influence theory of atonement. Both views are popular within the Roman Catholic church, with the satisfaction doctrine incorporated into the idea of penance.",5727a9314b864d19001639c3,How important is Jesus' death to modern theology?,False,central importance,306,324
London,"A number of universities in London are outside the University of London system, including Brunel University, City University London, Imperial College London, Kingston University, London Metropolitan University, Middlesex University, University of East London, University of West London and University of Westminster, (with over 34,000 students, the largest unitary university in London), London South Bank University, Middlesex University, University of the Arts London (the largest university of art, design, fashion, communication and the performing arts in Europe), University of East London, the University of West London and the University of Westminster. In addition there are three international universities in London – Regent's University London, Richmond, The American International University in London and Schiller International University.",57289db33acd2414000dfb6e,What is Europe's largest university for degrees in communication and performing arts?,False,University of the Arts London,440,469
Premier_League,"Television has played a major role in the history of the Premier League. The League's decision to assign broadcasting rights to BSkyB in 1992 was at the time a radical decision, but one that has paid off. At the time pay television was an almost untested proposition in the UK market, as was charging fans to watch live televised football. However, a combination of Sky's strategy, the quality of Premier League football and the public's appetite for the game has seen the value of the Premier League's TV rights soar.",5733efac4776f41900661560,What sort of television was BSkyB that made it such a radical broadcaster to choose for the Premier League?,False,pay television,217,231
Communications_in_Somalia,"The Somali Postal Service (Somali Post) is the national postal service of the Federal Government of Somalia. It is part of the Ministry of Information, Posts and Telecommunication.",56e1b959cd28a01900c67ad1,What is the name of the National postal service of Somalia?,False,Somali Post,4,15
The_Bronx,"The Bronx is the home of the New York Yankees of Major League Baseball. The original Yankee Stadium opened in 1923 on 161st Street and River Avenue, a year that saw the Yankees bring home their first of 27 World Series Championships. With the famous facade, the short right field porch and Monument Park, Yankee Stadium has been home to many of baseball's greatest players including Babe Ruth, Lou Gehrig, Joe DiMaggio, Whitey Ford, Yogi Berra, Mickey Mantle, Reggie Jackson, Derek Jeter and Mariano Rivera.",5732674b0fdd8d15006c6a9a,Which historic great players have played at Yankee Stadium?,False,"Babe Ruth, Lou Gehrig, Joe DiMaggio, Whitey Ford, Yogi Berra, Mickey Mantle, Reggie Jackson, Derek Jeter and Mariano Rivera",383,506
Law_of_the_United_States,"Tort law covers the entire imaginable spectrum of wrongs which humans can inflict upon each other, and of course, partially overlaps with wrongs also punishable by criminal law. Although the American Law Institute has attempted to standardize tort law through the development of several versions of the Restatement of Torts, many states have chosen to adopt only certain sections of the Restatements and to reject others. Thus, because of its immense size and diversity, American tort law cannot be easily summarized.",572673ef5951b619008f7312,Why can American tort law not be easily summarized?,False,because of its immense size and diversity,428,469
Nonprofit_organization,"The board of directors has ultimate control over the organization, but typically an executive director is hired. In some cases, the board is elected by a membership, but commonly, the board of directors is self-perpetuating. In these ""board-only"" organizations, board members nominate new members and vote on their fellow directors nominations. Part VI, section A, question 7a of the Form 990 asks ""members, stockholders, or other persons who had the power to elect or appoint one or more members of the governing body?"".",57277db8708984140094df17,"Where, on Form 990, does an organization have to list what type of board they have?",False,"Part VI, section A, question 7a",345,376
Web_browser,"The primary purpose of a web browser is to bring information resources to the user (""retrieval"" or ""fetching""), allowing them to view the information (""display"", ""rendering""), and then access other information (""navigation"", ""following links"").",56e0d09f7aa994140058e73f,What is the main use of a browser?,False,to bring information resources to the user,40,82
Modern_history,"After World War II, Europe was informally split into Western and Soviet spheres of influence. Western Europe later aligned as the North Atlantic Treaty Organization (NATO) and Eastern Europe as the Warsaw Pact. There was a shift in power from Western Europe and the British Empire to the two new superpowers, the United States and the Soviet Union. These two rivals would later face off in the Cold War. In Asia, the defeat of Japan led to its democratization. China's civil war continued through and after the war, resulting eventually in the establishment of the People's Republic of China. The former colonies of the European powers began their road to independence.",572f96ce947a6a140053ca8e,What was Europe split into after World War II?,False,Western and Soviet spheres of influence.,53,93
Pub,"Traditional English ale was made solely from fermented malt. The practice of adding hops to produce beer was introduced from the Netherlands in the early 15th century. Alehouses would each brew their own distinctive ale, but independent breweries began to appear in the late 17th century. By the end of the century almost all beer was brewed by commercial breweries.",56dfb9fe231d4119001abd17,In what century was the process of using hops to produce beer introduced to England?,False,15th,154,158
Antibiotics,"In April 2013, the Infectious Disease Society of America (IDSA) reported that the weak antibiotic pipeline does not match bacteria's increasing ability to develop resistance. Since 2009, only 2 new antibiotics were approved in the United States. The number of new antibiotics approved for marketing per year declines continuously. The report identified seven antibiotics against the Gram-negative bacilli (GNB) currently in phase 2 or phase 3 clinical trials. However, these drugs do not address the entire spectrum of resistance of GNB. Some of these antibiotics are combination of existent treatments:",5733d88b4776f41900661346,What year did the Infectious Disease Society of America say that production of new antibiotics does not keep up with resistance?,False,2013,9,13
Southampton,"Southampton had an estimated 236,900 people living within the city boundary in 2011. There is a sizeable Polish population in the city, with estimates as high as 20,000.",56f8a0d99b226e1400dd0d03,"In 2011, what was the estimated population of Southampton inside city limits?",False,"236,900",29,36
Beyoncé,"Beyoncé has received numerous awards. As a solo artist she has sold over 15 million albums in the US, and over 118 million records worldwide (a further 60 million additionally with Destiny's Child), making her one of the best-selling music artists of all time. The Recording Industry Association of America (RIAA) listed Beyoncé as the top certified artist of the 2000s, with a total of 64 certifications. Her songs ""Crazy in Love"", ""Single Ladies (Put a Ring on It)"", ""Halo"", and ""Irreplaceable"" are some of the best-selling singles of all time worldwide. In 2009, The Observer named her the Artist of the Decade and Billboard named her the Top Female Artist and Top Radio Songs Artist of the Decade. In 2010, Billboard named her in their ""Top 50 R&B/Hip-Hop Artists of the Past 25 Years"" list at number 15. In 2012 VH1 ranked her third on their list of the ""100 Greatest Women in Music"". Beyoncé was the first female artist to be honored with the International Artist Award at the American Music Awards. She has also received the Legend Award at the 2008 World Music Awards and the Billboard Millennium Award at the 2011 Billboard Music Awards.",56d4eb762ccc5a1400d83351,How many certifications did RIAA give Beyoncé?,False,64,387,389
Buckingham_Palace,"At the centre of this wing is the famous balcony with the Centre Room behind its glass doors. This is a Chinese-style saloon enhanced by Queen Mary, who, working with the designer Sir Charles Allom, created a more ""binding"" Chinese theme in the late 1920s, although the lacquer doors were brought from Brighton in 1873. Running the length of the piano nobile of the east wing is the great gallery, modestly known as the Principal Corridor, which runs the length of the eastern side of the quadrangle. It has mirrored doors, and mirrored cross walls reflecting porcelain pagodas and other oriental furniture from Brighton. The Chinese Luncheon Room and Yellow Drawing Room are situated at each end of this gallery, with the Centre Room obviously placed in the centre.",57261935ec44d21400f3d8cb,Which room feature the famous balcony?,False,Centre Room,58,69
John_Kerry,"During his tour on the guided missile frigate USS Gridley, Kerry requested duty in South Vietnam, listing as his first preference a position as the commander of a Fast Patrol Craft (PCF), also known as a ""Swift boat."" These 50-foot (15 m) boats have aluminum hulls and have little or no armor, but are heavily armed and rely on speed. ""I didn't really want to get involved in the war"", Kerry said in a book of Vietnam reminiscences published in 1986. ""When I signed up for the swift boats, they had very little to do with the war. They were engaged in coastal patrolling and that's what I thought I was going to be doing."" However, his second choice of billet was on a river patrol boat, or ""PBR"", which at the time was serving a more dangerous duty on the rivers of Vietnam.",572aa3c1111d821400f38c6b,How long were swift boats?,False,50-foot,224,231
Detroit,"In 2010, the G.R. N'Namdi Gallery opened in a 16,000-square-foot (1,500 m2) complex in Midtown. Important history of America and the Detroit area are exhibited at The Henry Ford in Dearborn, the United States' largest indoor-outdoor museum complex. The Detroit Historical Society provides information about tours of area churches, skyscrapers, and mansions. Inside Detroit, meanwhile, hosts tours, educational programming, and a downtown welcome center. Other sites of interest are the Detroit Zoo in Royal Oak, the Cranbrook Art Museum in Bloomfield Hills, the Anna Scripps Whitcomb Conservatory on Belle Isle, and Walter P. Chrysler Museum in Auburn Hills.",5728ce8f2ca10214002da84d,Where is the Detroit Zoo?,False,Royal Oak,501,510
Thuringia,"The GDP of Thuringia is below the national average, in line with the other former East German Lands. Until 2004, Thuringia was one of the weakest regions within the European Union. The accession of several new countries, the crisis in southern Europe and the sustained economic growth in Germany since 2005 has brought the Thuringian GDP close to the EU average since then. The high economic subsidies granted by the federal government and the EU after 1990 are being reduced gradually and will end around 2020.",57267adb5951b619008f7409,What has helped to improve Thuringia? ,False,"The accession of several new countries, the crisis in southern Europe and the sustained economic growth",181,284
Seven_Years%27_War,"Prussia emerged from the war as a great power whose importance could no longer be challenged. Frederick the Great’s personal reputation was enormously enhanced, as his debt to fortune (Russia’s volte-face after Elizabeth’s death) and to the British subsidy were soon forgotten while the memory of his energy and his military genius was strenuously kept alive. Russia, on the other hand, made one great invisible gain from the war: the elimination of French influence in Poland. The First Partition of Poland (1772) was to be a Russo-Prussian transaction, with Austria only reluctantly involved and with France simply ignored.",572fc05ca23a5019007fc968,What was the general opinion of Frederick the Great military acumen?,False,his military genius was strenuously kept alive,312,358
Bird_migration,"The most pelagic species, mainly in the 'tubenose' order Procellariiformes, are great wanderers, and the albatrosses of the southern oceans may circle the globe as they ride the ""roaring forties"" outside the breeding season. The tubenoses spread widely over large areas of open ocean, but congregate when food becomes available. Many are also among the longest-distance migrants; sooty shearwaters Puffinus griseus nesting on the Falkland Islands migrate 14,000 km (8,700 mi) between the breeding colony and the North Atlantic Ocean off Norway. Some Manx shearwaters Puffinus puffinus do this same journey in reverse. As they are long-lived birds, they may cover enormous distances during their lives; one record-breaking Manx shearwater is calculated to have flown 8 million km (5 million miles) during its over-50 year lifespan.",5706865b75f01819005e7bd0,How far will Puffinus griseus migrate each year?,False,"14,000 km",455,464
Sino-Tibetan_relations_during_the_Ming_dynasty,"Soon after the victory in Ü-Tsang, Güshi Khan organized a welcoming ceremony for Lozang Gyatso once he arrived a day's ride from Shigatse, presenting his conquest of Tibet as a gift to the Dalai Lama. In a second ceremony held within the main hall of the Shigatse fortress, Güshi Khan enthroned the Dalai Lama as the ruler of Tibet, but conferred the actual governing authority to the regent Sonam Chöpel. Although Güshi Khan had granted the Dalai Lama ""supreme authority"" as Goldstein writes, the title of 'King of Tibet' was conferred upon Güshi Khan, spending his summers in pastures north of Lhasa and occupying Lhasa each winter. Van Praag writes that at this point Güshi Khan maintained control over the armed forces, but accepted his inferior status towards the Dalai Lama. Rawski writes that the Dalai Lama shared power with his regent and Güshi Khan during his early secular and religious reign. However, Rawski states that he eventually ""expanded his own authority by presenting himself as Avalokiteśvara through the performance of rituals,"" by building the Potala Palace and other structures on traditional religious sites, and by emphasizing lineage reincarnation through written biographies. Goldstein states that the government of Güshi Khan and the Dalai Lama persecuted the Karma Kagyu sect, confiscated their wealth and property, and even converted their monasteries into Gelug monasteries. Rawski writes that this Mongol patronage allowed the Gelugpas to dominate the rival religious sects in Tibet.",56ce4d2baab44d1400b88690,Who did Güshi Khan enthrone the ruler of Tibet?,False,the Dalai Lama,185,199
The_Sun_(United_Kingdom),"The Sun, during the Miners' strike of 1984–85, supported the police and the Thatcher government against the striking NUM miners, and in particular the union's president, Arthur Scargill. On 23 May 1984, The Sun prepared a front page with the headline ""Mine Führer"" and a photograph of Scargill with his arm in the air, a pose which made him look as though he was giving a Nazi salute. The print workers at The Sun refused to print it. The Sun strongly supported the April 1986 bombing of Libya by the US, which was launched from British bases. Several civilians were killed during the bombing. Their leader was ""Right Ron, Right Maggie"". That year, Labour MP Clare Short attempted in vain to persuade Parliament to outlaw the pictures on Page Three and gained opprobrium from the newspaper for her stand.",5726893c5951b619008f7627,What did a picture of Scargill have him appear to be doing?,False,giving a Nazi salute,363,383
Alps,"The first British Mont Blanc ascent was in 1788; the first female ascent in 1819. By the mid-1850s Swiss mountaineers had ascended most of the peaks and were eagerly sought as mountain guides. Edward Whymper reached the top of the Matterhorn in 1865 (after seven attempts), and in 1938 the last of the six great north faces of the Alps was climbed with the first ascent of the Eiger Nordwand (north face of the Eiger).",56f88e93a6d7ea1400e1775b,When were the last of the six great north faces of the Alps climbed? ,False,1938,281,285
Buddhism,"Buddhism traditionally incorporates states of meditative absorption (Pali: jhāna; Skt: dhyāna). The most ancient sustained expression of yogic ideas is found in the early sermons of the Buddha. One key innovative teaching of the Buddha was that meditative absorption must be combined with liberating cognition. The difference between the Buddha's teaching and the yoga presented in early Brahminic texts is striking. Meditative states alone are not an end, for according to the Buddha, even the highest meditative state is not liberating. Instead of attaining a complete cessation of thought, some sort of mental activity must take place: a liberating cognition, based on the practice of mindful awareness.",56d20db9e7d4791d00902637,The difference between the Buddha's teaching and the yoga presented in what what type of texts is significant?,False,Brahminic,388,397
List_of_numbered_streets_in_Manhattan,"Above 114th Street between Amsterdam Avenue and Morningside Drive, there is a private indoor pedestrian bridge connecting two buildings on the campus of St. Luke's–Roosevelt Hospital Center.",56f94b2d9b226e1400dd12f9,Aove 114th Street is a private pedestrian bridge connecting two buildings from what organization?,False,St. Luke's–Roosevelt Hospital Center,153,189
Alps,"Many rodents such as voles live underground. Marmots live almost exclusively above the tree line as high as 2,700 m (8,858 ft). They hibernate in large groups to provide warmth, and can be found in all areas of the Alps, in large colonies they build beneath the alpine pastures. Golden eagles and bearded vultures are the largest birds to be found in the Alps; they nest high on rocky ledges and can be found at altitudes of 2,400 m (7,874 ft). The most common bird is the alpine chough which can be found scavenging at climber's huts or at the Jungfraujoch, a high altitude tourist destination.",56f8b0ae9b226e1400dd0e12,What is the most common bird found in the Alps?,False,the alpine chough,469,486
Virgil,"The Georgics' tone wavers between optimism and pessimism, sparking critical debate on the poet's intentions, but the work lays the foundations for later didactic poetry. Virgil and Maecenas are said to have taken turns reading the Georgics to Octavian upon his return from defeating Antony and Cleopatra at the Battle of Actium in 31 BC.",56f896ab9e9bad19000a0196,When did Octavian return from the Battle of Actium?,False,31 BC,331,336
Oklahoma,"The humid subtropical climate (Koppen Cfa) of central, southern and eastern Oklahoma is influenced heavily by southerly winds bringing moisture from the Gulf of Mexico. Traveling westward, the climate transitions progressively toward a semi-arid zone (Koppen BSk) in the high plains of the Panhandle and other western areas from about Lawton westward, less frequently touched by southern moisture. Precipitation and temperatures decline from east to west accordingly, with areas in the southeast averaging an annual temperature of 62 °F (17 °C) and an annual rainfall of generally over 40 inches (1,020 mm) and up to 56 inches (1,420 mm), while areas of the (higher-elevation) panhandle average 58 °F (14 °C), with an annual rainfall under 17 inches (430 mm).",5727d1953acd2414000ded37,What is Oklahoma's western climate type?,False,semi-arid,236,245
Queen_Victoria,"According to one of her biographers, Giles St Aubyn, Victoria wrote an average of 2,500 words a day during her adult life. From July 1832 until just before her death, she kept a detailed journal, which eventually encompassed 122 volumes. After Victoria's death, her youngest daughter, Princess Beatrice, was appointed her literary executor. Beatrice transcribed and edited the diaries covering Victoria's accession onwards, and burned the originals in the process. Despite this destruction, much of the diaries still exist. In addition to Beatrice's edited copy, Lord Esher transcribed the volumes from 1832 to 1861 before Beatrice destroyed them. Part of Victoria's extensive correspondence has been published in volumes edited by A. C. Benson, Hector Bolitho, George Earle Buckle, Lord Esher, Roger Fulford, and Richard Hough among others.",57267d5c5951b619008f7485,Who was Victoria's literary executer?,False,"her youngest daughter, Princess Beatrice",262,302
Czech_language,"The languages have not undergone the deliberate highlighting of minor linguistic differences in the name of nationalism as has occurred in the Bosnian, Serbian and Croatian standards of Serbo-Croatian. However, most Slavic languages (including Czech) have been distanced in this way from Russian influences because of widespread public resentment against the former Soviet Union (which occupied Czechoslovakia in 1968). Czech and Slovak form a dialect continuum, with great similarity between neighboring Czech and Slovak dialects. (See ""Dialects"" below.)",572b6d5934ae481900deadfb,What language does Czech form a dialect continuum with?,False,Slovak,430,436
War_on_Terror,"On 7 August 1998, al-Qaeda struck the U.S. embassies in Kenya and Tanzania, killing 224 people, including 12 Americans. In retaliation, U.S. President Bill Clinton launched Operation Infinite Reach, a bombing campaign in Sudan and Afghanistan against targets the U.S. asserted were associated with WIFJAJC, although others have questioned whether a pharmaceutical plant in Sudan was used as a chemical warfare plant. The plant produced much of the region's antimalarial drugs and around 50% of Sudan's pharmaceutical needs. The strikes failed to kill any leaders of WIFJAJC or the Taliban.",572843362ca10214002da1e3,How many people were killed when al-Qaeda attacked US embassies in 1998?,False,224,84,87
Qing_dynasty,"Yongzheng also inherited diplomatic and strategic problems. A team made up entirely of Manchus drew up the Treaty of Kyakhta (1727) to solidify the diplomatic understanding with Russia. In exchange for territory and trading rights, the Qing would have a free hand dealing with the situation in Mongolia. Yongzheng then turned to that situation, where the Zunghars threatened to re-emerge, and to the southwest, where local Miao chieftains resisted Qing expansion. These campaigns drained the treasury but established the emperor's control of the military and military finance.",57313c06e6313a140071cd63,Who was the partner in the Treaty of Kyakhta?,False,Russia,178,184
