title,context,question_id,question_text,is_impossible,answer_text,answer_start,answer_end
Washington_University_in_St._Louis,"Washington University's sports teams are called the Bears. They are members of the National Collegiate Athletic Association and participate in the University Athletic Association at the Division III level. The Bears have won 19 NCAA Division III Championships— one in women's cross country (2011), one in men's tennis (2008), two in men's basketball (2008, 2009), five in women's basketball (1998–2001, 2010), and ten in women's volleyball (1989, 1991–1996, 2003, 2007, 2009) – and 144 UAA titles in 15 different sports. The Athletic Department is headed by John Schael who has served as director of athletics since 1978. The 2000 Division III Central Region winner of the National Association of Collegiate Directors of Athletics/Continental Airlines Athletics Director of the Year award, Schael has helped orchestrate the Bears athletics transformation into one of the top departments in Division III.",573015da04bcaa1900d77158,In what years did the Washington University men's basketball teams win division championships?,False,"2008, 2009",351,361
Dell,"Dell's manufacturing process covers assembly, software installation, functional testing (including ""burn-in""), and quality control. Throughout most of the company's history, Dell manufactured desktop machines in-house and contracted out manufacturing of base notebooks for configuration in-house. The company's approach has changed, as cited in the 2006 Annual Report, which states, ""We are continuing to expand our use of original design manufacturing partnerships and manufacturing outsourcing relationships."" The Wall Street Journal reported in September 2008 that ""Dell has approached contract computer manufacturers with offers to sell"" their plants. By the late 2000s, Dell's ""configure to order"" approach of manufacturing—delivering individual PCs configured to customer specifications from its US facilities was no longer as efficient or competitive with high-volume Asian contract manufacturers as PCs became powerful low-cost commodities.",570fc88e80d9841400ab367e,Where did Dell configure their notebooks?,False,in-house,287,295
Transistor,"Although several companies each produce over a billion individually packaged (known as discrete) transistors every year, the vast majority of transistors are now produced in integrated circuits (often shortened to IC, microchips or simply chips), along with diodes, resistors, capacitors and other electronic components, to produce complete electronic circuits. A logic gate consists of up to about twenty transistors whereas an advanced microprocessor, as of 2009, can use as many as 3 billion transistors (MOSFETs). ""About 60 million transistors were built in 2002… for [each] man, woman, and child on Earth.""",572ee0cc03f9891900756ab7,What are some abbreviations for integrated circuits?,False,"IC, microchips or simply chips",214,244
Anti-aircraft_warfare,"Poland's AA defences were no match for the German attack and the situation was similar in other European countries. Significant AA warfare started with the Battle of Britain in the summer of 1940. 3.7-inch HAA were to provide the backbone of the groundbased AA defences, although initially significant numbers of 3-inch 20-cwt were also used. The Army's Anti-aircraft command, which was under command of the Air Defence UK organisation, grew to 12 AA divisions in 3 AA corps. 40-mm Bofors entered service in increasing numbers. In addition the RAF regiment was formed in 1941 with responsibility for airfield air defence, eventually with Bofors 40mm as their main armament. Fixed AA defences, using HAA and LAA, were established by the Army in key overseas places, notably Malta, Suez Canal and Singapore.",570d94dfb3d812140066da6a,What battle marked the beginning of significant antiaircraft warfare?,False,Battle of Britain,156,173
Seven_Years%27_War,"The war had also brought to an end the ""Old System"" of alliances in Europe, In the years after the war, under the direction of Lord Sandwich, the British did try to re-establish this system. But after her surprising grand success against a coalition of great powers, European states such as Austria, The Dutch Republic, Sweden, Denmark-Norway, Ottoman Empire, and Russia now saw Britain as a greater threat than France and did not join them, while the Prussians were angered by what they considered a British betrayal in 1762. Consequently, when the American War of Independence turned into a global war between 1778–83, Britain found itself opposed by a strong coalition of European powers, and lacking any substantial ally.",572fc3ed04bcaa1900d76cb3,Did the European countries see Britain or France as a greater threat?,False,now saw Britain as a greater threat than France,371,418
List_of_numbered_streets_in_Manhattan,"27th Street is a one-way street runs from Second Avenue to the West Side Highway with an interruption between Eighth Avenue and Tenth Avenue. It is most noted for its strip between Tenth and Eleventh Avenues, known as Club Row because it features numerous nightclubs and lounges.",56f93d7d9b226e1400dd12b9,Does traffuc on 27th Street run one-way or two-ways?,False,one-way,17,24
Memory,"Infants do not have the language ability to report on their memories and so verbal reports cannot be used to assess very young children’s memory. Throughout the years, however, researchers have adapted and developed a number of measures for assessing both infants’ recognition memory and their recall memory. Habituation and operant conditioning techniques have been used to assess infants’ recognition memory and the deferred and elicited imitation techniques have been used to assess infants’ recall memory.",571a39aa4faf5e1900b8a930,How can a researcher study a childs memory?,False,elicited imitation techniques,431,460
Printed_circuit_board,"Electrochemical migration (ECM) is the growth of conductive metal filaments on or in a printed circuit board (PCB) under the influence of a DC voltage bias. Silver, zinc, and aluminum are known to grow whiskers under the influence of an electric field. Silver also grows conducting surface paths in the presence of halide and other ions, making it a poor choice for electronics use. Tin will grow ""whiskers"" due to tension in the plated surface. Tin-Lead or solder plating also grows whiskers, only reduced by the percentage Tin replaced. Reflow to melt solder or tin plate to relieve surface stress lowers whisker incidence. Another coating issue is tin pest, the transformation of tin to a powdery allotrope at low temperature.",572fb648b2c2fd140056839d,What's the process whereby metal filaments are grown on or in a PCB via DC voltage?,False,Electrochemical migration,0,25
Endangered_Species_Act,"Fish and Wildlife Service (FWS) and National Marine Fisheries Service (NMFS) are required to create an Endangered Species Recovery Plan outlining the goals, tasks required, likely costs, and estimated timeline to recover endangered species (i.e., increase their numbers and improve their management to the point where they can be removed from the endangered list). The ESA does not specify when a recovery plan must be completed. The FWS has a policy specifying completion within three years of the species being listed, but the average time to completion is approximately six years. The annual rate of recovery plan completion increased steadily from the Ford administration (4) through Carter (9), Reagan (30), Bush I (44), and Clinton (72), but declined under Bush II (16 per year as of 9/1/06).",572eb435cb0c0d14000f1492,What Recovery Plan duration the does Fish and Wildlife Service plan for in their policies?,False,completion within three years,462,491
Financial_crisis_of_2007%E2%80%9308,"The first visible institution to run into trouble in the United States was the Southern California–based IndyMac, a spin-off of Countrywide Financial. Before its failure, IndyMac Bank was the largest savings and loan association in the Los Angeles market and the seventh largest mortgage originator in the United States. The failure of IndyMac Bank on July 11, 2008, was the fourth largest bank failure in United States history up until the crisis precipitated even larger failures, and the second largest failure of a regulated thrift. IndyMac Bank's parent corporation was IndyMac Bancorp until the FDIC seized IndyMac Bank. IndyMac Bancorp filed for Chapter 7 bankruptcy in July 2008.",5733679bd058e614000b5a50,"Before its failure, which savings and loan association was the seventh largest mortgage originator in the United States?",False,IndyMac Bank,171,183
Philadelphia,"Southeastern Pennsylvania was assigned the 215 area code in 1947 when the North American Numbering Plan of the ""Bell System"" went into effect. The geographic area covered by the code was split nearly in half in 1994 when area code 610 was created, with the city and its northern suburbs retaining 215. Overlay area code 267 was added to the 215 service area in 1997, and 484 was added to the 610 area in 1999. A plan in 2001 to introduce a third overlay code to both service areas (area code 445 to 215, area code 835 to 610) was delayed and later rescinded.",572acb2b34ae481900deacf6,When was the 610 area code added?,False,1994,211,215
Hydrogen,"Hydrogen's rarer isotopes also each have specific applications. Deuterium (hydrogen-2) is used in nuclear fission applications as a moderator to slow neutrons, and in nuclear fusion reactions. Deuterium compounds have applications in chemistry and biology in studies of reaction isotope effects. Tritium (hydrogen-3), produced in nuclear reactors, is used in the production of hydrogen bombs, as an isotopic label in the biosciences, and as a radiation source in luminous paints.",56e1a3b2cd28a01900c67a43,What is tritium used for?,False,"production of hydrogen bombs, as an isotopic label in the biosciences, and as a radiation source in luminous paints",363,478
Dutch_language,"During the second half of the 19th century Dutch was banned from all levels of education by both Prussia and France and lost most of its functions as a cultural language. In both Germany and France the Dutch standard language is largely absent and speakers of these Dutch dialects will use German or French in everyday speech. Dutch is not afforded legal status in France or Germany, either by the central or regional public authorities and knowledge of the language is declining among younger generations.",572668875951b619008f71d6,"Other than France, what country does not give Dutch legal status as a language?",False,Germany,375,382
Economy_of_Greece,"In 2010 Piraeus handled 513,319 TEUs, followed by Thessaloniki, which handled 273,282 TEUs. In the same year, 83.9 million people passed through Greece's ports, 12.7 million through the port of Paloukia in Salamis, another 12.7 through the port of Perama, 9.5 million through Piraeus and 2.7 million through Igoumenitsa. In 2013, Piraeus handled a record 3.16 million TEUs, the third-largest figure in the Mediterranean, of which 2.52 million were transported through Pier II, owned by COSCO and 644,000 were transported through Pier I, owned by the Greek state.",57321d1eb9d445190005e81a,What amount of TEUs did Thessaloniki handle in 2010?,False,"273,282",78,85
"New_Haven,_Connecticut","The city is home to New Haven Promise, a scholarship funded by Yale University for students who meet the requirements. Students must be enrolled in a public high school (charters included) for four years, be a resident of the city during that time, carry a 3.0 cumulative grade-point average, have a 90-percent attendance rate and perform 40 hours of service to the city. The initiative was launched in 2010 and there are currently more than 500 Scholars enrolled in qualifying Connecticut colleges and universities. There are more than 60 cities in the country that have a Promise-type program for their students.",5727abea3acd2414000de941,How many hours of community service must a student perform in order to be eligible for the New Haven Promise scholarship?,False,40 hours,339,347
Buddhism,"In the 2nd century CE, Mahayana Sutras spread to China, and then to Korea and Japan, and were translated into Chinese. During the Indian period of Esoteric Buddhism (from the 8th century onwards), Buddhism spread from India to Tibet and Mongolia.",56d278ee59d6e41400146028,Mahayana Sutras spread to China during what century?,False,2nd century CE,7,21
Central_Intelligence_Agency,"The CIA established its first training facility, the Office of Training and Education, in 1950. Following the end of the Cold War, the CIA's training budget was slashed, which had a negative effect on employee retention. In response, Director of Central Intelligence George Tenet established CIA University in 2002. CIA University holds between 200 and 300 courses each year, training both new hires and experienced intelligence officers, as well as CIA support staff. The facility works in partnership with the National Intelligence University, and includes the Sherman Kent School for Intelligence Analysis, the Directorate of Analysis' component of the university.",572f4f74a23a5019007fc51b,How many annual courses does the CIA University have?,False,between 200 and 300,337,356
Oklahoma_City,"The Midwest Regional Medical Center located in the suburb of Midwest City; other major hospitals in the city include the Oklahoma Heart Hospital and the Mercy Health Center. There are 347 physicians for every 100,000 people in the city.",56df8b7d38dc42170015202e,Where is the Midwest Regional Medical Center?,False,Midwest City,61,73
Post-punk,"Generally, post-punk music is defined as music that emerged from the cultural milieu of punk rock in the late 1970s, although many groups now categorized as post-punk were initially subsumed under the broad umbrella of punk or new wave music, only becoming differentiated as the terms came to signify more narrow styles. Additionally, the accuracy of the term's chronological prefix ""post"" has been disputed, as various groups commonly labeled post-punk in fact predate the punk rock movement. Reynolds defined the post-punk era as occurring loosely between 1978 and 1984.",572e6bacc246551400ce422f,Who has defined a period of when the post-punk era was?,False,Reynolds,494,502
Boston,"Some of the most renowned and highly ranked universities in the world are located in the Boston area. Four members of the Association of American Universities are in Greater Boston (more than any other metropolitan area): Harvard University, the Massachusetts Institute of Technology, Boston University, and Brandeis University. Hospitals, universities, and research institutions in Greater Boston received more than $1.77 billion in National Institutes of Health grants in 2013, more money than any other American metropolitan area. Greater Boston has more than 100 colleges and universities, with 250,000 students enrolled in Boston and Cambridge alone. Its largest private universities include Boston University (the city's fourth-largest employer) with its main campus along Commonwealth Avenue and a medical campus in the South End; Northeastern University in the Fenway area; Suffolk University near Beacon Hill, which includes law school and business school; and Boston College, which straddles the Boston (Brighton)–Newton border. Boston's only public university is the University of Massachusetts Boston, on Columbia Point in Dorchester. Roxbury Community College and Bunker Hill Community College are the city's two public community colleges. Altogether, Boston's colleges and universities employ over 42,600 people, accounting for nearly 7 percent of the city's workforce.",56e1500fcd28a01900c677a5,Who is the citys fourth largest employer?,False,Boston University,285,302
Alfred_North_Whitehead,"In Whitehead's view, then, concepts such as ""quality"", ""matter"", and ""form"" are problematic. These ""classical"" concepts fail to adequately account for change, and overlook the active and experiential nature of the most basic elements of the world. They are useful abstractions, but are not the world's basic building blocks. What is ordinarily conceived of as a single person, for instance, is philosophically described as a continuum of overlapping events. After all, people change all the time, if only because they have aged by another second and had some further experience. These occasions of experience are logically distinct, but are progressively connected in what Whitehead calls a ""society"" of events. By assuming that enduring objects are the most real and fundamental things in the universe, materialists have mistaken the abstract for the concrete (what Whitehead calls the ""fallacy of misplaced concreteness"").",57333fbad058e614000b57d4,How did Whitehead classify what is usually seen as an individual person?,False,a continuum of overlapping events,423,456
Kievan_Rus%27,"To the southwest, the principality of Halych had developed trade relations with its Polish, Hungarian and Lithuanian neighbours and emerged as the local successor to Kievan Rus'. In 1199, Prince Roman Mstislavich united the two previously separate principalities. In 1202 he conquered Kiev, and assumed the title of Grand Duke of Kievan Rus', which was held by the rulers of Vladimir-Suzdal since 1169. His son, Prince Daniil (r. 1238–1264) looked for support from the West. He accepted a crown as a ""Rex Rusiae"" (""King of Russia"") from the Roman papacy, apparently doing so without breaking with Constantinople. In 1370, the patriarch of the Eastern Orthodox Church in Constantinople granted the King of Poland a metropolitan for his Russian subjects. Lithuanian rulers also requested and received a metropolitan for Novagrudok shortly afterwards. Cyprian, a candidate pushed by the Lithuanian rulers, became Metropolitan of Kiev in 1375 and metropolitan of Moscow in 1382; this way the church in the Russian countries was reunited for some time. In 1439, Kiev became the seat of a separate ""Metropolitan of Kiev, Galich and all Rus'"" for all Greek Orthodox Christians under Polish-Lithuanian rule.",5731417005b4da19006bcf5e,Which neighbors did Halych develop trade relations with?,False,"Polish, Hungarian and Lithuanian",84,116
Presbyterianism,"Presbyterianism first officially arrived in Colonial America in 1703 with the establishment of the first Presbytery in Philadelphia. In time, the presbytery would be joined by two more to form a synod (1717) and would eventually evolve into the Presbyterian Church in the United States of America in 1789. The nation's largest Presbyterian denomination, the Presbyterian Church (U.S.A.) – PC (USA) – can trace their heritage back to the original PCUSA, as can the Presbyterian Church in America (PCA), the Orthodox Presbyterian Church (OPC), the Bible Presbyterian Church (BPC), the Cumberland Presbyterian Church (CPC), the Cumberland Presbyterian Church in America the Evangelical Presbyterian Church (EPC) and the Evangelical Covenant Order of Presbyterians (ECO).",572684a7dd62a815002e87f7,What is the name of the largest denomination of the Presbyterian Church in America?,False,the Presbyterian Church (U.S.A.),354,386
Molotov%E2%80%93Ribbentrop_Pact,"The Soviets also helped Germany to avoid British naval blockades by providing a submarine base, Basis Nord, in the northern Soviet Union near Murmansk. This also provided a refueling and maintenance location, and a takeoff point for raids and attacks on shipping. In addition, the Soviets provided Germany with access to the Northern Sea Route for both cargo ships and raiders (though only the commerce raider Komet used the route before the German invasion), which forced Britain to protect sea lanes in both the Atlantic and the Pacific.",5726dc97708984140094d3f6,Where was the sub base located?,False,northern Soviet Union near Murmansk,115,150
Gramophone_record,"The development of quadraphonic records was announced in 1971. These recorded four separate sound signals. This was achieved on the two stereo channels by electronic matrixing, where the additional channels were combined into the main signal. When the records were played, phase-detection circuits in the amplifiers were able to decode the signals into four separate channels. There were two main systems of matrixed quadraphonic records produced, confusingly named SQ (by CBS) and QS (by Sansui). They proved commercially unsuccessful, but were an important precursor to later surround-sound systems, as seen in SACD and home cinema today.",5727c5ccff5b5019007d94d4,What did quadraphonic recording feature?,False,recorded four separate sound signals.,69,106
Switzerland,"Christianity is the predominant religion of Switzerland (about 71% of resident population and 75% of Swiss citizens), divided between the Catholic Church (38.21% of the population), the Swiss Reformed Church (26.93%), further Protestant churches (2.89%) and other Christian denominations (2.79%). There has been a recent rise in Evangelicalism. Immigration has brought Islam (4.95%) and Eastern Orthodoxy (around 2%) as sizeable minority religions. According to a 2015 poll by Gallup International, 12% of Swiss people self-identified as ""convinced atheists.""",5727b7c74b864d1900163b4a,What religion has immigration brought by 2%?,False,Eastern Orthodoxy,387,404
Bird,"Plumage is regularly moulted; the standard plumage of a bird that has moulted after breeding is known as the ""non-breeding"" plumage, or—in the Humphrey-Parkes terminology—""basic"" plumage; breeding plumages or variations of the basic plumage are known under the Humphrey-Parkes system as ""alternate"" plumages. Moulting is annual in most species, although some may have two moults a year, and large birds of prey may moult only once every few years. Moulting patterns vary across species. In passerines, flight feathers are replaced one at a time with the innermost primary being the first. When the fifth of sixth primary is replaced, the outermost tertiaries begin to drop. After the innermost tertiaries are moulted, the secondaries starting from the innermost begin to drop and this proceeds to the outer feathers (centrifugal moult). The greater primary coverts are moulted in synchrony with the primary that they overlap. A small number of species, such as ducks and geese, lose all of their flight feathers at once, temporarily becoming flightless. As a general rule, the tail feathers are moulted and replaced starting with the innermost pair. Centripetal moults of tail feathers are however seen in the Phasianidae. The centrifugal moult is modified in the tail feathers of woodpeckers and treecreepers, in that it begins with the second innermost pair of feathers and finishes with the central pair of feathers so that the bird maintains a functional climbing tail. The general pattern seen in passerines is that the primaries are replaced outward, secondaries inward, and the tail from center outward. Before nesting, the females of most bird species gain a bare brood patch by losing feathers close to the belly. The skin there is well supplied with blood vessels and helps the bird in incubation.",57314d0e497a881900248d89,What is regularly moulted?,False,Plumage,0,7
Emotion,"The motor centers of reptiles react to sensory cues of vision, sound, touch, chemical, gravity, and motion with pre-set body movements and programmed postures. With the arrival of night-active mammals, smell replaced vision as the dominant sense, and a different way of responding arose from the olfactory sense, which is proposed to have developed into mammalian emotion and emotional memory. The mammalian brain invested heavily in olfaction to succeed at night as reptiles slept—one explanation for why olfactory lobes in mammalian brains are proportionally larger than in the reptiles. These odor pathways gradually formed the neural blueprint for what was later to become our limbic brain.",570a7e7c4103511400d59778,What parts of reptiles respond to sensory cues?,False,motor centers,4,17
Qing_dynasty,"From 1889, when Guangxu began to rule in his own right, to 1898, the Empress Dowager lived in semi-retirement, spending the majority of the year at the Summer Palace. On November 1, 1897, two German Roman Catholic missionaries were murdered in the southern part of Shandong Province (the Juye Incident). In response, Germany used the murders as a pretext for a naval occupation of Jiaozhou Bay. The occupation prompted a ""scramble for concessions"" in 1898, which included the German lease of Jiazhou Bay, the Russian acquisition of Liaodong, and the British lease of the New Territories of Hong Kong.",57314c0e05b4da19006bcff6,Where were the missionaries killed?,False,Shandong Province,265,282
American_Idol,"Both finalists found success after the show, but Aiken out-performed Studdard's coronation song ""Flying Without Wings"" with his single release from the show ""This Is the Night"", as well as in their subsequent album releases. The fourth-place finisher Josh Gracin also enjoyed some success as a country singer.",56d372d559d6e414001463fd,What song did Clay Aiken first release after losing American Idol?,False,This Is the Night,158,175
Avicenna,"His Book of Healing became available in Europe in partial Latin translation some fifty years after its composition, under the title Sufficientia, and some authors have identified a ""Latin Avicennism"" as flourishing for some time, paralleling the more influential Latin Averroism, but suppressed by the Parisian decrees of 1210 and 1215. Avicenna's psychology and theory of knowledge influenced William of Auvergne, Bishop of Paris and Albertus Magnus, while his metaphysics had an impact on the thought of Thomas Aquinas.",5726ce2fdd62a815002e90dc,On what continent was the Book of Healing finally available fifty years after its composition?,False,Europe,40,46
