title,context,question_id,question_text,is_impossible,answer_text,answer_start,answer_end
Political_corruption,"Corruption is often most evident in countries with the smallest per capita incomes, relying on foreign aid for health services. Local political interception of donated money from overseas is especially prevalent in Sub-Saharan African nations, where it was reported in the 2006 World Bank Report that about half of the funds that were donated for health usages were never invested into the health sectors or given to those needing medical attention.",56ea97140030b61400a34fc0,Which report described this corruption? ,False,the 2006 World Bank Report,269,295
Muslim_world,"In astronomy, Muḥammad ibn Jābir al-Ḥarrānī al-Battānī improved the precision of the measurement of the precession of the Earth's axis. The corrections made to the geocentric model by al-Battani, Averroes, Nasir al-Din al-Tusi, Mu'ayyad al-Din al-'Urdi and Ibn al-Shatir were later incorporated into the Copernican heliocentric model. Heliocentric theories were also discussed by several other Muslim astronomers such as Al-Biruni, Al-Sijzi, Qotb al-Din Shirazi, and Najm al-Dīn al-Qazwīnī al-Kātibī. The astrolabe, though originally developed by the Greeks, was perfected by Islamic astronomers and engineers, and was subsequently brought to Europe.",572ffdb7947a6a140053cf02,What model did the work of Muslim World astronomers contribute to?,False,the Copernican heliocentric model,300,333
Printed_circuit_board,"Matte solder is usually fused to provide a better bonding surface or stripped to bare copper. Treatments, such as benzimidazolethiol, prevent surface oxidation of bare copper. The places to which components will be mounted are typically plated, because untreated bare copper oxidizes quickly, and therefore is not readily solderable. Traditionally, any exposed copper was coated with solder by hot air solder levelling (HASL). The HASL finish prevents oxidation from the underlying copper, thereby guaranteeing a solderable surface. This solder was a tin-lead alloy, however new solder compounds are now used to achieve compliance with the RoHS directive in the EU and US, which restricts the use of lead. One of these lead-free compounds is SN100CL, made up of 99.3% tin, 0.7% copper, 0.05% nickel, and a nominal of 60ppm germanium.",572fb2d4b2c2fd140056836d,What happens to untreated copper that makes it difficult to solder?,False,oxidizes,275,283
Federal_Aviation_Administration,"The FAA gradually assumed additional functions. The hijacking epidemic of the 1960s had already brought the agency into the field of civil aviation security. In response to the hijackings on September 11, 2001, this responsibility is now primarily taken by the Department of Homeland Security. The FAA became more involved with the environmental aspects of aviation in 1968 when it received the power to set aircraft noise standards. Legislation in 1970 gave the agency management of a new airport aid program and certain added responsibilities for airport safety. During the 1960s and 1970s, the FAA also started to regulate high altitude (over 500 feet) kite and balloon flying.",570aa92f6d058f1900183033,When was legislation passed that gave the agency management of a new airport aide program?,False,1970,449,453
Paper,"There are three main chemical pulping processes: the sulfite process dates back to the 1840s and it was the dominant method extent before the second world war. The kraft process, invented in the 1870s and first used in the 1890s, is now the most commonly practiced strategy, one of its advantages is the chemical reaction with lignin, that produces heat, which can be used to run a generator. Most pulping operations using the kraft process are net contributors to the electricity grid or use the electricity to run an adjacent paper mill. Another advantage is that this process recovers and reuses all inorganic chemical reagents. Soda pulping is another specialty process used to pulp straws, bagasse and hardwoods with high silicate content.",56e74eaf00c9c71400d76f81,What decade does the sulfite process date to?,False,1840s,87,92
War_on_Terror,"In a 'Letter to American People' written by Osama bin Laden in 2002, he stated that one of the reasons he was fighting America is because of its support of India on the Kashmir issue. While on a trip to Delhi in 2002, U.S. Secretary of Defense Donald Rumsfeld suggested that Al-Qaeda was active in Kashmir, though he did not have any hard evidence. An investigation in 2002 unearthed evidence that Al-Qaeda and its affiliates were prospering in Pakistan-administered Kashmir with tacit approval of Pakistan's National Intelligence agency Inter-Services Intelligence. A team of Special Air Service and Delta Force was sent into Indian-administered Kashmir in 2002 to hunt for Osama bin Laden after reports that he was being sheltered by the Kashmiri militant group Harkat-ul-Mujahideen. U.S. officials believed that Al-Qaeda was helping organize a campaign of terror in Kashmir in order to provoke conflict between India and Pakistan. Fazlur Rehman Khalil, the leader of the Harkat-ul-Mujahideen, signed al-Qaeda's 1998 declaration of holy war, which called on Muslims to attack all Americans and their allies. Indian sources claimed that In 2006, Al-Qaeda claimed they had established a wing in Kashmir; this worried the Indian government. India also claimed that Al-Qaeda has strong ties with the Kashmir militant groups Lashkar-e-Taiba and Jaish-e-Mohammed in Pakistan. While on a visit to Pakistan in January 2010, U.S. Defense secretary Robert Gates stated that Al-Qaeda was seeking to destabilize the region and planning to provoke a nuclear war between India and Pakistan.",57284a5bff5b5019007da104,Who wrote 'Letter to American People' in 2002?,False,Osama bin Laden,44,59
Dell,"Dell became the first company in the information technology industry to establish a product-recycling goal (in 2004) and completed the implementation of its global consumer recycling-program in 2006. On February 6, 2007, the National Recycling Coalition awarded Dell its ""Recycling Works"" award for efforts to promote producer responsibility. On July 19, 2007, Dell announced that it had exceeded targets in working to achieve a multi-year goal of recovering 275 million pounds of computer equipment by 2009. The company reported the recovery of 78 million pounds (nearly 40,000 tons) of IT equipment from customers in 2006, a 93-percent increase over 2005; and 12.4% of the equipment Dell sold seven years earlier.",570fcfe65ab6b81900391037,What was Dell the first IT company to establish?,False,product-recycling goal,84,106
Circadian_rhythm,"Melatonin is absent from the system or undetectably low during daytime. Its onset in dim light, dim-light melatonin onset (DLMO), at roughly 21:00 (9 p.m.) can be measured in the blood or the saliva. Its major metabolite can also be measured in morning urine. Both DLMO and the midpoint (in time) of the presence of the hormone in the blood or saliva have been used as circadian markers. However, newer research indicates that the melatonin offset may be the more reliable marker. Benloucif et al. found that melatonin phase markers were more stable and more highly correlated with the timing of sleep than the core temperature minimum. They found that both sleep offset and melatonin offset are more strongly correlated with phase markers than the onset of sleep. In addition, the declining phase of the melatonin levels is more reliable and stable than the termination of melatonin synthesis.",570f40f65ab6b81900390eb3,What chemical is absent or low during daylight?,False,Melatonin,0,9
Digimon,"The fourth Digimon series, which began airing on April 7, 2002, radically departs from the previous three by focusing on a new and very different kind of evolution, Spirit Evolution, in which the human characters use their D-Tectors (this series' Digivice) to transform themselves into special Digimon called Legendary Warriors, detracting from the customary formula of having digital partners. After receiving unusual phone messages from Ophanimon (one of the three ruling Digimon alongside Seraphimon and Cherubimon) Takuya Kanbara, Koji Minamoto, Junpei Shibayama, Zoe Orimoto, Tommy Himi, and Koichi Kimura go to a subway station and take a train to the Digital World. Summoned by Ophanimon, the Digidestined realize that they must find the ten legendary spirits and stop the forces of Cherubimon from physically destroying the Digital World. After finding the ten spirits of the Legendary Warriors and defeating Mercurymon, Grumblemon, Ranamon, and Arbormon, they finally end up fighting Cherubimon hoping to foil his effort to dominate the Digital World. After the defeat of Cherubimon, the Digidestined find they must face an even greater challenge as they try to stop the Royal Knights—Dynasmon and Crusadermon—from destroying the Digital World and using the collected data to revive the original ruler of the Digital World: the tyrannical Lucemon. Ultimately the Digidestined fail in preventing Lucemon from reawakening but they do manage to prevent him from escaping into the Real World. In the final battle, all of the legendary spirits the digidestined have collected thus far merge and create Susanoomon. With this new form, the digidestined are able to effectively defeat Lucemon and save the Digital World. In general, Frontier has a much lighter tone than that of Tamers, yet remains darker than Adventure and Adventure 02.",572a2ba8af94a219006aa864,"After the characters transformed into special Digimons, what were they called?",False,Legendary Warriors,309,327
2008_Sichuan_earthquake,"Office buildings in Shanghai's financial district, including the Jin Mao Tower and the Hong Kong New World Tower, were evacuated. A receptionist at the Tibet Hotel in Chengdu said things were ""calm"" after the hotel evacuated its guests. Meanwhile, workers at a Ford plant in Sichuan were evacuated for about 10 minutes. Chengdu Shuangliu International Airport was shut down, and the control tower and regional radar control evacuated. One SilkAir flight was diverted and landed in Kunming as a result. Cathay Pacific delayed both legs of its quadruple daily Hong Kong to London route due to this disruption in air traffic services. Chengdu Shuangliu Airport reopened later on the evening of May 12, offering limited service as the airport began to be used as a staging area for relief operations.",56cdd63a62d2951400fa68d7,How did a receptionist describe the atmosphere after the evacuation?,False,calm,193,197
Palermo,"The so-called ""Sack of Palermo"" is one of the major visible faces of the problem. The term is used to indicate the speculative building practices that have filled the city with poor buildings. The reduced importance of agriculture in the Sicilian economy has led to a massive migration to the cities, especially Palermo, which swelled in size, leading to rapid expansion towards the north. The regulatory plans for expansion was largely ignored in the boom. New parts of town appeared almost out of nowhere, but without parks, schools, public buildings, proper roads and the other amenities that characterise a modern city.",572967351d046914007793ab,"To what does the term ""Sack of Palermo"" refer?",False,speculative building practices that have filled the city with poor buildings,115,191
Switzerland,"The restoration of power to the patriciate was only temporary. After a period of unrest with repeated violent clashes such as the Züriputsch of 1839, civil war (the Sonderbundskrieg) broke out in 1847 when some Catholic cantons tried to set up a separate alliance (the Sonderbund). The war lasted for less than a month, causing fewer than 100 casualties, most of which were through friendly fire. Yet however minor the Sonderbundskrieg appears compared with other European riots and wars in the 19th century, it nevertheless had a major impact on both the psychology and the society of the Swiss and of Switzerland.",57277f175951b619008f8b5d,What did Catholic cantons attempt to set up which caused a civil war in 1839?,False,a separate alliance (the Sonderbund),244,280
Law_of_the_United_States,"Tort law covers the entire imaginable spectrum of wrongs which humans can inflict upon each other, and of course, partially overlaps with wrongs also punishable by criminal law. Although the American Law Institute has attempted to standardize tort law through the development of several versions of the Restatement of Torts, many states have chosen to adopt only certain sections of the Restatements and to reject others. Thus, because of its immense size and diversity, American tort law cannot be easily summarized.",572cbe52750c471900ed4d26,What covers crimes of human against human?,False,Tort law,0,8
Samurai,"In the same war, the Prussian Edward Schnell served the Aizu domain as a military instructor and procurer of weapons. He was granted the Japanese name Hiramatsu Buhei (平松武兵衛), which inverted the characters of the daimyo's name Matsudaira. Hiramatsu (Schnell) was given the right to wear swords, as well as a residence in the castle town of Wakamatsu, a Japanese wife, and retainers. In many contemporary references, he is portrayed wearing a Japanese kimono, overcoat, and swords, with Western riding trousers and boots.",5728fb8a6aef05140015493e,Who did Edward Schnell work for?,False,the Aizu domain,52,67
Hyderabad,"In the 2005 National Family Health Survey, it was reported that the city's total fertility rate is 1.8,:47 which is below the replacement rate. Only 61% of children had been provided with all basic vaccines (BCG, measles and full courses of polio and DPT), fewer than in all other surveyed cities except Meerut.:98 The infant mortality rate was 35 per 1,000 live births, and the mortality rate for children under five was 41 per 1,000 live births.:97 The survey also reported that a third of women and a quarter of men are overweight or obese, 49% of children below 5 years are anaemic, and up to 20% of children are underweight,:44, 55–56 while more than 2% of women and 3% of men suffer from diabetes.:57",572f86ea947a6a140053ca23,According to a 2005 survey what was in Hyderabad?,False,"35 per 1,000 live births",345,369
Josip_Broz_Tito,"In 1936, when Tito stayed at the Hotel Lux in Moscow, he met the Austrian comrade Lucia Bauer. They married in October 1936, but the records of this marriage were later erased.",56f827c4aef2371900625e51,What is the name of the Austrian comrade Tito met in Moscow in 1936?,False,Lucia Bauer,82,93
Switzerland,"The government has established an Integration Office under the Department of Foreign Affairs and the Department of Economic Affairs. To minimise the negative consequences of Switzerland's isolation from the rest of Europe, Bern and Brussels signed seven bilateral agreements to further liberalise trade ties. These agreements were signed in 1999 and took effect in 2001. This first series of bilateral agreements included the free movement of persons. A second series covering nine areas was signed in 2004 and has since been ratified, which includes the Schengen Treaty and the Dublin Convention besides others. They continue to discuss further areas for cooperation.",5727a8874b864d19001639b8,How many bilateral agreements did Bern and Brussels sign to further liberalise trade ties?,False,seven,248,253
Middle_Ages,"Jewish communities were expelled from England in 1290 and from France in 1306. Although some were allowed back into France, most were not, and many Jews emigrated eastwards, settling in Poland and Hungary. The Jews were expelled from Spain in 1492, and dispersed to Turkey, France, Italy, and Holland. The rise of banking in Italy during the 13th century continued throughout the 14th century, fuelled partly by the increasing warfare of the period and the needs of the papacy to move money between kingdoms. Many banking firms loaned money to royalty, at great risk, as some were bankrupted when kings defaulted on their loans.[AE]",56fb88f8b28b3419009f1e0c,In what year were the Jews expelled from England?,False,1290,49,53
The_Times,"After 14 years as editor, William Rees-Mogg resigned the post upon completion of the change of ownership. Murdoch began to make his mark on the paper by appointing Harold Evans as his replacement. One of his most important changes was the introduction of new technology and efficiency measures. In March–May 1982, following agreement with print unions, the hot-metal Linotype printing process used to print The Times since the 19th century was phased out and replaced by computer input and photo-composition. This allowed print room staff at The Times and The Sunday Times to be reduced by half. However, direct input of text by journalists (""single stroke"" input) was still not achieved, and this was to remain an interim measure until the Wapping dispute of 1986, when The Times moved from New Printing House Square in Gray's Inn Road (near Fleet Street) to new offices in Wapping.",5705fed175f01819005e784a,"When The Times was bought in 1982, who resigned as editor?",False,William Rees-Mogg,26,43
Comics,"Shorter, black-and-white daily strips began to appear early in the 20th century, and became established in newspapers after the success in 1907 of Bud Fisher's Mutt and Jeff. Humour strips predominated at first, and in the 1920s and 1930s strips with continuing stories in genres such as adventure and drama also became popular. Thin periodicals called comic books appeared in the 1930s, at first reprinting newspaper comic strips; by the end of the decade, original content began to dominate. The success in 1938 of Action Comics and its lead hero Superman marked the beginning of the Golden Age of Comic Books, in which the superhero genre was prominent.",56e020e2231d4119001abf4a,When did comic books make an appearance?,False,1930s,233,238
BBC_Television,"The two systems were to run on a trial basis for six months; early television sets supported both resolutions. However, the Baird system, which used a mechanical camera for filmed programming and Farnsworth image dissector cameras for live programming, proved too cumbersome and visually inferior, and ended with closedown (at 22:00) on Saturday 13 February 1937. ",56de69b84396321400ee28a9,When was the Baird system officially abandoned?,False,13 February 1937,346,362
Bern,"In 1353 Bern joined the Swiss Confederacy, becoming one of the eight cantons of the formative period of 1353 to 1481. Bern invaded and conquered Aargau in 1415 and Vaud in 1536, as well as other smaller territories; thereby becoming the largest city-state north of the Alps, by the 18th century comprising most of what is today the canton of Bern and the canton of Vaud.",56e8638c37bdd419002c44e1,How many cantons were there between 1353 to 1481?,False,8,114,115
Central_African_Republic,"Patassé purged many of the Kolingba elements from the government and Kolingba supporters accused Patassé's government of conducting a ""witch hunt"" against the Yakoma. A new constitution was approved on 28 December 1994 but had little impact on the country's politics. In 1996–1997, reflecting steadily decreasing public confidence in the government's erratic behaviour, three mutinies against Patassé's administration were accompanied by widespread destruction of property and heightened ethnic tension. During this time (1996) the Peace Corps evacuated all its volunteers to neighboring Cameroon. To date, the Peace Corps has not returned to the Central African Republic. The Bangui Agreements, signed in January 1997, provided for the deployment of an inter-African military mission, to Central African Republic and re-entry of ex-mutineers into the government on 7 April 1997. The inter-African military mission was later replaced by a U.N. peacekeeping force (MINURCA).",572812164b864d19001643aa,The mutinies caused what effects on the country?,False,widespread destruction of property,438,472
John_Kerry,"In a speech before the Organization of American States in November 2013, Kerry remarked that the era of the Monroe Doctrine was over. He went on to explain, ""The relationship that we seek and that we have worked hard to foster is not about a United States declaration about how and when it will intervene in the affairs of other American states. It's about all of our countries viewing one another as equals, sharing responsibilities, cooperating on security issues, and adhering not to doctrine, but to the decisions that we make as partners to advance the values and the interests that we share.""",572ac813111d821400f38d69,"What did Kerry say had ended, in the Nov 2013 speech?",False,the era of the Monroe Doctrine,93,123
Economy_of_Greece,"Between 2005 and 2011, Greece has had the highest percentage increase in industrial output compared to 2005 levels out of all European Union members, with an increase of 6%. Eurostat statistics show that the industrial sector was hit by the Greek financial crisis throughout 2009 and 2010, with domestic output decreasing by 5.8% and industrial production in general by 13.4%. Currently, Greece is ranked third in the European Union in the production of marble (over 920,000 tons), after Italy and Spain.",57321440b9d445190005e7b7,What did the industrial production in Greece fall by due to the financial crisis?,False,13.4%.,370,376
CBC_Television,"Many were surprised by these changes to the CBC schedule, which were apparently intended to attract a younger audience to the network; some suggested they might alienate the core CBC viewership. Another note of criticism was made when the network decided to move The National in some time zones to simulcast the American version of The One over the summer. This later became a moot point, as The One was taken off the air after two weeks after extremely low American and Canadian ratings, and the newscast resumed its regular schedule.",572a373d6aef051400155393,Why did CBC move The National in some areas?,False,to simulcast the American version of The One over the summer,295,355
High-definition_television,"Several systems were proposed as the new standard for the US, including the Japanese MUSE system, but all were rejected by the FCC because of their higher bandwidth requirements. At this time, the number of television channels was growing rapidly and bandwidth was already a problem. A new standard had to be more efficient, needing less bandwidth for HDTV than the existing NTSC.",56f9e6119b226e1400dd15f2,Why did the FCC reject systems such as MUSE?,False,their higher bandwidth requirements,142,177
Botany,"Most sexually reproducing organisms are diploid, with paired chromosomes, but doubling of their chromosome number may occur due to errors in cytokinesis. This can occur early in development to produce an autopolyploid or partly autopolyploid organism, or during normal processes of cellular differentiation to produce some cell types that are polyploid (endopolyploidy), or during gamete formation. An allopolyploid plant may result from a hybridisation event between two different species. Both autopolyploid and allopolyploid plants can often reproduce normally, but may be unable to cross-breed successfully with the parent population because there is a mismatch in chromosome numbers. These plants that are reproductively isolated from the parent species but live within the same geographical area, may be sufficiently successful to form a new species. Some otherwise sterile plant polyploids can still reproduce vegetatively or by seed apomixis, forming clonal populations of identical individuals. Durum wheat is a fertile tetraploid allopolyploid, while bread wheat is a fertile hexaploid. The commercial banana is an example of a sterile, seedless triploid hybrid. Common dandelion is a triploid that produces viable seeds by apomictic seed.",57274d2bdd62a815002e9ab8,What can cause the doubling of chromosome pairs?,False,errors in cytokinesis,131,152
Heian_period,"While on one hand the Heian period was an unusually long period of peace, it can also be argued that the period weakened Japan economically and led to poverty for all but a tiny few of its inhabitants. The control of rice fields provided a key source of income for families such as the Fujiwara and were a fundamental base for their power. The aristocratic beneficiaries of Heian culture, the Ryōmin (良民 ""Good People"") numbered about five thousand in a land of perhaps five million. One reason the samurai were able to take power was that the ruling nobility proved incompetent at managing Japan and its provinces. By the year 1000 the government no longer knew how to issue currency and money was gradually disappearing. Instead of a fully realised system of money circulation, rice was the primary unit of exchange. The lack of a solid medium of economic exchange is implicitly illustrated in novels of the time. For instance, messengers were rewarded with useful objects, e.g., an old silk kimono, rather than paid a fee.",5727824bdd62a815002e9f14,What crop was a primary source of income during the Heian period?,False,rice,217,221
Oklahoma,"Following the 2000 census, the Oklahoma delegation to the U.S. House of Representatives was reduced from six to five representatives, each serving one congressional district. For the 112th Congress (2011–2013), there were no changes in party strength, and the delegation included four Republicans and one Democrat. In the 112th Congress, Oklahoma's U.S. senators were Republicans Jim Inhofe and Tom Coburn, and its U.S. Representatives were John Sullivan (R-OK-1), Dan Boren (D-OK-2), Frank D. Lucas (R-OK-3), Tom Cole (R-OK-4), and James Lankford (R-OK-5).",5727e7144b864d1900163fa2,How many US House reps did Oklahoma have before the 2000 census?,False,six,105,108
