title,context,question_id,question_text,is_impossible,answer_text,answer_start,answer_end
Plymouth,"Plymouth has about 150 churches and its Roman Catholic cathedral (1858) is in Stonehouse. The city's oldest church is St Andrew's (Anglican) located at the top of Royal Parade—it is the largest parish church in Devon and has been a site of gathering since AD 800. The city also includes five Baptist churches, over twenty Methodist chapels, and thirteen Roman Catholic churches. In 1831 the first Brethren assembly in England, a movement of conservative non-denominational Evangelical Christians, was established in the city, so that Brethren are often called Plymouth Brethren, although the movement did not begin locally.",56df72255ca0a614008f9a6c,In what year was Plymouth's Catholic cathedral built?,False,1858,66,70
Adult_contemporary_music,"A more elaborate form of urban AC is the rhythmic oldies format, which focuses primarily on ""old school"" R&B and soul hits from the 1960s to the 1990s, including Motown and disco hits. The format includes soul or disco artists such as ABBA, The Village People, The Jackson 5, Donna Summer, Tina Charles, Gloria Gaynor and the Bee Gees. Rhythmic oldies stations still exist today, but target African-Americans as opposed to a mass audience.",56e6f3976fe0821900b8ec57,What is the target demographic of the rhythmic oldies format?,False,African-Americans,391,408
Guinea-Bissau,"The word gumbe is sometimes used generically, to refer to any music of the country, although it most specifically refers to a unique style that fuses about ten of the country's folk music traditions. Tina and tinga are other popular genres, while extent folk traditions include ceremonial music used in funerals, initiations and other rituals, as well as Balanta brosca and kussundé, Mandinga djambadon, and the kundere sound of the Bissagos Islands.",56f8f22f9e9bad19000a0755,"Other than gumbe, what are two popular music genres?",False,Tina and tinga,200,214
Hindu_philosophy,"The metaphysics in Mīmāṃsā school consists of both atheistic and theistic doctrines and the school showed little interest in systematic examination of the existence of God. Rather, it held that the soul is eternal omnipresent, inherently active spiritual essence, then focussed on the epistemology and metaphysics of dharma. To them, dharma meant rituals and duties, not devas (gods), because devas existed only in name. The Mīmāṃsākas held that the Vedas are ""eternal authorless infallible"", that Vedic vidhi (injunctions) and mantras in rituals are prescriptive karya (actions), and the rituals are of primary importance and merit. They considered the Upanishads and other self-knowledge, spirituality-related texts to be of secondary importance, a philosophical view that the Vedanta school disagreed with.",5727a2bbff5b5019007d9178,What was the focus of the Mimamsa school of philosophy?,False,dharma,317,323
Nanjing,"Nanjing borders Yangzhou to the northeast, one town downstream when following the north bank of the Yangtze, Zhenjiang to the east, one town downstream when following the south bank of the Yangtze, and Changzhou to the southeast. On its western boundary is Anhui province, where Nanjing borders five prefecture-level cities, Chuzhou to the northwest, Wuhu, Chaohu and Maanshan to the west and Xuancheng to the southwest.",56e79a5837bdd419002c4206,How many prefecture-size cities are in the province of Anhui?,False,five,295,299
Ministry_of_Defence_(United_Kingdom),"The MoD has since been regarded as a leader in elaborating the post-Cold War organising concept of ""defence diplomacy"". As a result of the Strategic Defence and Security Review 2010, Prime Minister David Cameron signed a 50-year treaty with French President Nicolas Sarkozy that would have the two countries co-operate intensively in military matters. The UK is establishing air and naval bases in the Persian Gulf, located in the UAE and Bahrain. A presence in Oman is also being considered.",56f97a649e9bad19000a0996,Who was the PM of Britain in 2010?,False,David Cameron,198,211
Immaculate_Conception,"The papal bull defining the dogma, Ineffabilis Deus, mentioned in particular the patrististic interpretation of Genesis 3:15 as referring to a woman, Mary, who would be eternally at enmity with the evil serpent and completely triumphing over him. It said the Fathers saw foreshadowings of Mary's ""wondrous abundance of divine gifts and original innocence"" ""in that ark of Noah, which was built by divine command and escaped entirely safe and sound from the common shipwreck of the whole world; in the ladder which Jacob saw reaching from the earth to heaven, by whose rungs the angels of God ascended and descended, and on whose top the Lord himself leaned; in that bush which Moses saw in the holy place burning on all sides, which was not consumed or injured in any way but grew green and blossomed beautifully; in that impregnable tower before the enemy, from which hung a thousand bucklers and all the armor of the strong; in that garden enclosed on all sides, which cannot be violated or corrupted by any deceitful plots; in that resplendent city of God, which has its foundations on the holy mountains; in that most august temple of God, which, radiant with divine splendours, is full of the glory of God; and in very many other biblical types of this kind.""",5730f90c497a881900248ab3,What holy document takes the view of Mary back to the creation of man and woman ?,False,"papal bull defining the dogma, Ineffabilis Deus",4,51
Dog,"In Hindu mythology, Yama, the god of death owns two watch dogs who have four eyes. They are said to watch over the gates of Naraka. Hunter god Muthappan from North Malabar region of Kerala has a hunting dog as his mount. Dogs are found in and out of the Muthappan Temple and offerings at the shrine take the form of bronze dog figurines.",56d63b901c85041400947039,"In Hindu mythology, what do the two dogs who are owned by the god of death watch over?",False,the gates of Naraka.,111,131
Eritrea,"Eritrea can be split into three ecoregions. To the east of the highlands are the hot, arid coastal plains stretching down to the southeast of the country. The cooler, more fertile highlands, reaching up to 3000m has a different habitat. Habitats here vary from the sub-tropical rainforest at Filfil Solomona to the precipitous cliffs and canyons of the southern highlands. The Afar Triangle or Danakil Depression of Eritrea is the probable location of a triple junction where three tectonic plates are pulling away from one another.The highest point of the country, Emba Soira, is located in the center of Eritrea, at 3,018 meters (9,902 ft) above sea level.",570db7e416d0071400510d33,How many ecoregions make up Eritrea?,False,three,26,31
Chinese_characters,"Contrary to the popular belief of there being only one script per period, there were in fact multiple scripts in use during the Han period. Although mature clerical script, also called 八分 (bāfēn) script, was dominant at that time, an early type of cursive script was also in use by the Han by at least as early as 24 BC (during the very late Western Han period),[b] incorporating cursive forms popular at the time, well as many elements from the vulgar writing of the Warring State of Qin. By around the time of the Eastern Jin dynasty, this Han cursive became known as 章草 zhāngcǎo (also known as 隶草 / 隸草 lìcǎo today), or in English sometimes clerical cursive, ancient cursive, or draft cursive. Some believe that the name, based on 章 zhāng meaning ""orderly"", arose because the script was a more orderly form of cursive than the modern form, which emerged during the Eastern Jin dynasty and is still in use today, called 今草 jīncǎo or ""modern cursive"".",5726d94d708984140094d379,Were multiple scripts used during the Han period?,False,there were in fact multiple scripts in use,74,116
The_Times,"The Sunday Times has a significantly higher circulation than The Times, and sometimes outsells The Sunday Telegraph. As of January 2013, The Times has a circulation of 399,339 and The Sunday Times of 885,612.",57060b8875f01819005e78ee,"As of January 2013, The Sunday Times has a circulation of how many people?",False,"885,612",200,207
London,"During the English Civil War the majority of Londoners supported the Parliamentary cause. After an initial advance by the Royalists in 1642 culminating in the battles of Brentford and Turnham Green, London was surrounded by defensive perimeter wall known as the Lines of Communication. The lines were built by an up to 20,000 people, and were completed in under two months. The fortifications failed their only test when the New Model Army entered London in 1647, and they were levelled by Parliament the same year.",5727fb052ca10214002d9a9e,Who did the Lines of Communication wall fail to prevent from coming into London?,False,the New Model Army,421,439
Race_and_ethnicity_in_the_United_States_Census,"For 1890, the Census Office changed the design of the population questionnaire. Residents were still listed individually, but a new questionnaire sheet was used for each family. Additionally, this was the first year that the census distinguished between different East Asian races, such as Japanese and Chinese, due to increased immigration. This census also marked the beginning of the term ""race"" in the questionnaires. Enumerators were instructed to write ""White,"" ""Black,"" ""Mulatto,"" ""Quadroon,"" ""Octoroon,"" ""Chinese,"" ""Japanese,"" or ""Indian.""",5709add7ed30961900e843f9,Why were different East Asian races divided in 1890 Census?,False,increased immigration,319,340
Dissolution_of_the_Soviet_Union,"On November 18, 1990, the Ukrainian Autocephalous Orthodox Church enthroned Mstyslav as Patriarch of Kiev and all Ukraine during ceremonies at Saint Sophia's Cathedral. Also on November 18, Canada announced that its consul-general to Kiev would be Ukrainian-Canadian Nestor Gayowsky. On November 19, the United States announced that its consul to Kiev would be Ukrainian-American John Stepanchuk. On November 19, the chairmen of the Ukrainian and Russian parliaments, respectively, Kravchuk and Yeltsin, signed a 10-year bilateral pact. In early December 1990 the Party of Democratic Rebirth of Ukraine was founded; on December 15, the Democratic Party of Ukraine was founded.",572843344b864d1900164854,Who was the Canadian consul-general to Kiev?,False,Nestor Gayowsky,267,282
Time,"Temporal measurement, chronometry, takes two distinct period forms: the calendar, a mathematical tool for organizing intervals of time, and the clock, a physical mechanism that counts the passage of time. In day-to-day life, the clock is consulted for periods less than a day whereas the calendar is consulted for periods longer than a day. Increasingly, personal electronic devices display both calendars and clocks simultaneously. The number (as on a clock dial or calendar) that marks the occurrence of a specified event as to hour or date is obtained by counting from a fiducial epoch—a central reference point.",5727fa0aff5b5019007d99b6,Which tool is used in day to day life?,False,the clock,225,234
Mosaic,"After 539 Ravenna was reconquered by the Romans in the form of the Eastern Roman Empire (Byzantine Empire) and became the seat of the Exarchate of Ravenna. The greatest development of Christian mosaics unfolded in the second half of the 6th century. Outstanding examples of Byzantine mosaic art are the later phase mosaics in the Basilica of San Vitale and Basilica of Sant'Apollinare Nuovo. The mosaic depicting Emperor Saint Justinian I and Empress Theodora in the Basilica of San Vitale were executed shortly after the Byzantine conquest. The mosaics of the Basilica of Sant'Apollinare in Classe were made around 549. The anti-Arian theme is obvious in the apse mosaic of San Michele in Affricisco, executed in 545–547 (largely destroyed; the remains in Berlin).",5731514505b4da19006bd03e,When was Ravenna conquered by the Eastern Roman Empire?,False,After 539,0,9
Macintosh,"The Macintosh, however, was expensive, which hindered its ability to be competitive in a market already dominated by the Commodore 64 for consumers, as well as the IBM Personal Computer and its accompanying clone market for businesses. Macintosh systems still found success in education and desktop publishing and kept Apple as the second-largest PC manufacturer for the next decade. In the 1990s, improvements in the rival Wintel platform, notably with the introduction of Windows 3.0, then Windows 95, gradually took market share from the more expensive Macintosh systems. The performance advantage of 68000-based Macintosh systems was eroded by Intel's Pentium, and in 1994 Apple was relegated to third place as Compaq became the top PC manufacturer. Even after a transition to the superior PowerPC-based Power Macintosh (later renamed the PowerMac, in line with the PowerBook series) line in 1994, the falling prices of commodity PC components and the release of Windows 95 saw the Macintosh user base decline.",570cd0bbb3d812140066d280,Where did Macintosh initially find success in the market?,False,education and desktop publishing,277,309
Computer,"In the 1770s Pierre Jaquet-Droz, a Swiss watchmaker, built a mechanical doll (automata) that could write holding a quill pen. By switching the number and order of its internal wheels different letters, and hence different messages, could be produced. In effect, it could be mechanically ""programmed"" to read instructions. Along with two other complex machines, the doll is at the Musée d'Art et d'Histoire of Neuchâtel, Switzerland, and still operates.",56fdc9b8761e401900d28bf9,What was the profession of Pierre Jaquet-Droz?,False,a Swiss watchmaker,33,51
"Atlantic_City,_New_Jersey","The median income for a household in the city was $26,969, and the median income for a family was $31,997. Males had a median income of $25,471 versus $23,863 for females. The per capita income for the city was $15,402. About 19.1% of families and 23.6% of the population were below the poverty line, including 29.1% of those under age 18 and 18.9% of those age 65 or over.",5706be1e0eeca41400aa0de8,What was the median income for a family in the city?,False,"$31,997",98,105
Sumer,"These deities formed a core pantheon; there were additionally hundreds of minor ones. Sumerian gods could thus have associations with different cities, and their religious importance often waxed and waned with those cities' political power. The gods were said to have created human beings from clay for the purpose of serving them. The temples organized the mass labour projects needed for irrigation agriculture. Citizens had a labor duty to the temple, though they could avoid it by a payment of silver.",5730b6398ab72b1400f9c6d6,How could a citizen avoid their labor duty to their local temple?,False,a payment of silver,485,504
Infection,"Techniques like hand washing, wearing gowns, and wearing face masks can help prevent infections from being passed from one person to another. Frequent hand washing remains the most important defense against the spread of unwanted organisms. There are other forms of prevention such as avoiding the use of illicit drugs, using a condom, and having a healthy lifestyle with a balanced diet and regular exercise. Cooking foods well and avoiding foods that have been left outside for a long time is also important.",57342b4c4776f419006619e7,What can wearing gowns and face masks help prevent?,False,infections from being passed from one person to another,85,140
PlayStation_3,"In January 2008, Kaz Hirai, CEO of Sony Computer Entertainment, suggested that the console may start making a profit by early 2009, stating that, ""the next fiscal year starts in April and if we can try to achieve that in the next fiscal year that would be a great thing"" and that ""[profitability] is not a definite commitment, but that is what I would like to try to shoot for"". However, market analysts Nikko Citigroup have predicted that PlayStation 3 could be profitable by August 2008. In a July 2008 interview, Hirai stated that his objective is for PlayStation 3 to sell 150 million units by its ninth year, surpassing PlayStation 2's sales of 140 million in its nine years on the market. In January 2009 Sony announced that their gaming division was profitable in Q3 2008.",57283c272ca10214002da144,What market analyst firm said Sony could make the PlayStation 3 profitable by August 2008?,False,Nikko Citigroup,404,419
Egypt,"Egypt actively practices capital punishment. Egypt's authorities do not release figures on death sentences and executions, despite repeated requests over the years by human rights organisations. The United Nations human rights office and various NGOs expressed ""deep alarm"" after an Egyptian Minya Criminal Court sentenced 529 people to death in a single hearing on 25 March 2014. Sentenced supporters of former President Mohamed Morsi will be executed for their alleged role in violence following his ousting in July 2013. The judgment was condemned as a violation of international law. By May 2014, approximately 16,000 people (and as high as more than 40,000 by one independent count), mostly Brotherhood members or supporters, have been imprisoned after the coup  after the Muslim Brotherhood was labelled as terrorist organisation by the post-coup interim Egyptian government.",573178c3497a881900248f44,In March 2014 what number of people were sentenced to death in a single hearing?,False,529,323,326
Idealism,"In philosophy, idealism is the group of philosophies which assert that reality, or reality as we can know it, is fundamentally mental, mentally constructed, or otherwise immaterial. Epistemologically, idealism manifests as a skepticism about the possibility of knowing any mind-independent thing. In a sociological sense, idealism emphasizes how human ideas—especially beliefs and values—shape society. As an ontological doctrine, idealism goes further, asserting that all entities are composed of mind or spirit. Idealism thus rejects physicalist and dualist theories that fail to ascribe priority to the mind.",572b6958be1ee31400cb8365,What do idealist philosophies say is constructed in our minds?,False,reality,83,90
Labour_Party_(UK),"Blair announced in September 2006 that he would quit as leader within the year, though he had been under pressure to quit earlier than May 2007 in order to get a new leader in place before the May elections which were expected to be disastrous for Labour. In the event, the party did lose power in Scotland to a minority Scottish National Party government at the 2007 elections and, shortly after this, Blair resigned as Prime Minister and was replaced by his Chancellor, Gordon Brown. Although the party experienced a brief rise in the polls after this, its popularity soon slumped to its lowest level since the days of Michael Foot. During May 2008, Labour suffered heavy defeats in the London mayoral election, local elections and the loss in the Crewe and Nantwich by-election, culminating in the party registering its worst ever opinion poll result since records began in 1943, of 23%, with many citing Brown's leadership as a key factor. Membership of the party also reached a low ebb, falling to 156,205 by the end of 2009: over 40 per cent of the 405,000 peak reached in 1997 and thought to be the lowest total since the party was founded.",572878f12ca10214002da3ab,When were the next elections?,False,May 2007,135,143
Buckingham_Palace,"State banquets also take place in the Ballroom; these formal dinners are held on the first evening of a state visit by a foreign head of state. On these occasions, for up to 170 guests in formal ""white tie and decorations"", including tiaras, the dining table is laid with the Grand Service, a collection of silver-gilt plate made in 1811 for the Prince of Wales, later George IV. The largest and most formal reception at Buckingham Palace takes place every November when the Queen entertains members of the diplomatic corps. On this grand occasion, all the state rooms are in use, as the royal family proceed through them, beginning at the great north doors of the Picture Gallery. As Nash had envisaged, all the large, double-mirrored doors stand open, reflecting the numerous crystal chandeliers and sconces, creating a deliberate optical illusion of space and light.",5725f0ec271a42140099d34c,When was the Grand Service made?,False,1811,333,337
Sichuan,"The Second Sino-Japanese War was soon followed by the resumed Chinese Civil War, and the cities of East China fell to the Communists one after another, the Kuomintang government again tried to make Sichuan its stronghold on the mainland, although it already saw some Communist activity since it was one area on the road of the Long March. Chiang Kai-Shek himself flew to Chongqing from Taiwan in November 1949 to lead the defense. But the same month Chongqing fell to the Communists, followed by Chengdu on 10 December. The Kuomintang general Wang Sheng wanted to stay behind with his troops to continue anticommunist guerilla war in Sichuan, but was recalled to Taiwan. Many of his soldiers made their way there as well, via Burma.",5727b298ff5b5019007d92cd,Why did Sichuan see some communist activity?,False,it was one area on the road of the Long March,292,337
American_Idol,"American Idol became the most expensive series on broadcast networks for advertisers starting season four, and by the next season, it had broken the record in advertising rate for a regularly scheduled prime-time network series, selling over $700,000 for a 30-seconds slot, and reaching up to $1.3 million for the finale. Its ad prices reached a peak in season seven at $737,000. Estimated revenue more than doubled from $404 million in season three to $870 million in season six. While that declined from season eight onwards, it still earned significantly more than its nearest competitor, with advertising revenue topping $800 million annually the next few seasons. However, the sharp drop in ratings in season eleven also resulted in a sharp drop in advertising rate for season twelve, and the show lost its leading position as the costliest show for advertisers. By 2014, ad revenue from had fallen to $427 million where a 30-second spot went for less than $300,000.",56d38bc459d6e414001466f4,How much did advertisers spend for a 30 second ad spot during American Idol in its seventh season? ,False,"$737,000",370,378
Nonprofit_organization,"During 2009, the federal government enacted new legislation repealing the Canada Corporations Act, Part II - the Canada Not-for-Profit Corporations Act. This Act was last amended on 10 October 2011 and the act was current till 4 March 2013. It allows for incorporation as of right, by Articles of Incorporation; does away with the ultra vires doctrine for nonprofits; establishes them as legal persons; and substantially updates the governance provisions for nonprofits. Ontario also overhauled its legislation, adopting the Ontario Not-for-Profit Corporations Act during 2010; pending the outcome of an anticipated election during October 2011,[dated info] the new Act is expected to be in effect as of 1 July 2013.",572774545951b619008f8a45,When was the Canada Not-for-Profit corporations Act last ammended?,False,10 October 2011,182,197
Political_philosophy,"The rise of Islam, based on both the Qur'an and Muhammad strongly altered the power balances and perceptions of origin of power in the Mediterranean region. Early Islamic philosophy emphasized an inexorable link between science and religion, and the process of ijtihad to find truth—in effect all philosophy was ""political"" as it had real implications for governance. This view was challenged by the ""rationalist"" Mutazilite philosophers, who held a more Hellenic view, reason above revelation, and as such are known to modern scholars as the first speculative theologians of Islam; they were supported by a secular aristocracy who sought freedom of action independent of the Caliphate. By the late ancient period, however, the ""traditionalist"" Asharite view of Islam had in general triumphed. According to the Asharites, reason must be subordinate to the Quran and the Sunna.",57269b7e708984140094cb85,Who challenged the early Islamic philosophy's views?,False,"the ""rationalist"" Mutazilite philosophers",396,437
Muammar_Gaddafi,"Muammar Gaddafi was born in a tent near Qasr Abu Hadi, a rural area outside the town of Sirte in the deserts of western Libya. His family came from a small, relatively un-influential tribal group called the Qadhadhfa, who were Arabized Berber in heritage. His father, Mohammad Abdul Salam bin Hamed bin Mohammad, was known as Abu Meniar (died 1985), and his mother was named Aisha (died 1978); Abu Meniar earned a meager subsistence as a goat and camel herder. Nomadic Bedouins, they were illiterate and kept no birth records. As such, Gaddafi's date of birth is not known with certainty, and sources have set it in 1942 or in the spring of 1943, although biographers Blundy and Lycett noted that it could have been pre-1940. His parents' only surviving son, he had three older sisters. Gaddafi's upbringing in Bedouin culture influenced his personal tastes for the rest of his life. He repeatedly expressed a preference for the desert over the city and retreated to the desert to meditate.",572eb93fdfa6aa1500f8d318,How did Gaddafi's father earn a living?,False,Abu Meniar earned a meager subsistence as a goat and camel herder,394,459
