question,passage,idx,label,ds_type
can you get a tattoo with an 18 year old,"Legal status of tattooing in the United States -- In the United States, there is no federal law regulating the practice of tattooing. However, all 50 states and the District of Columbia have statutory laws requiring a person receiving a tattoo be 18 years of age or older. This is partially based on the legal principle that a minor cannot enter into a legal contract or otherwise render informed consent for a procedure. Most states permit a person under the age of 18 to receive a tattoo with permission of a parent or guardian, but some states outright prohibit tattooing under a certain age regardless of permission, with the exception of medical necessity (such as markings placed for radiation therapy).",478,1,train
are there two versions of ren and stimpy,"Ren & Stimpy ""Adult Party Cartoon"" -- Ren & Stimpy ``Adult Party Cartoon'' (also known as ``Ren & Stimpy's All New Adult Party Cartoon'') was an American adult animation television series created by Canadian animator John Kricfalusi for the cable network The New TNN, which later changed its name to Spike TV and now Paramount Network. The series was developed as an ``extreme'' revamp of The Ren & Stimpy Show, which had previously aired on the American children's cable network Nickelodeon, and is noted for being significantly more vulgar and inappropriate than the original series.",479,1,train
is the federal reserve bank of new york a government agency,"Federal Reserve Bank of New York -- The Federal Reserve Bank of New York is one of the 12 Federal Reserve Banks of the United States. It is located at 33 Liberty Street, New York, NY. It is responsible for the Second District of the Federal Reserve System, which encompasses New York State, the 12 northern counties of New Jersey, Fairfield County in Connecticut, Puerto Rico, and the U.S. Virgin Islands. Working within the Federal Reserve System, the New York Federal Reserve Bank implements monetary policy, supervises and regulates financial institutions and helps maintain the nation's payment systems.",480,1,train
does the octet rule apply to all elements,"Octet rule -- The octet rule is a chemical rule of thumb that reflects observation that atoms of main-group elements tend to combine in such a way that each atom has eight electrons in its valence shell, giving it the same electron configuration as a noble gas. The rule is especially applicable to carbon, nitrogen, oxygen, and the halogens, but also to metals such as sodium or magnesium.",481,0,train
does canada's prime minister hold a seat in the house of commons,"House of Commons of Canada -- Though it does not formally elect the prime minister, the House of Commons indirectly controls the premiership. By convention, the prime minister is answerable to, and must maintain the support of, the House of Commons. Thus, whenever the office of prime minister falls vacant, the governor general has the duty of appointing the person most likely to command the support of the House--normally the leader of the largest party in the lower house, although the system allows a coalition of two or more parties. This has not happened in the Canadian federal parliament, but has occurred in Canadian provinces. The leader of the second-largest party (or in the case of a coalition, the largest party out of government) usually becomes the Leader of the Official Opposition. Moreover, the prime minister is, by unwritten convention, a member of the House of Commons, rather than of the Senate. Only two prime ministers governed from the Senate: Sir John Abbott (1891--1892) and Sir Mackenzie Bowell (1894--1896). Both men got the job following the death of a Prime Minister, and did not contest elections.",482,0,train
do you have to pay to be on judge judy,"Judge Judy -- Both the plaintiff(s) and the defendant(s) also receive an appearance fee. The appearance fee amount has varied as between different litigants of the show: certain litigants have reported receiving a $500 appearance fee while others have reported receiving $100, and others $250. In addition to the appearance fee amount, litigants are paid $35 a day by the show. The litigants' stay lasts for the number of days that the show does taping for that week, which is two or three days. In addition, the airfare (or other means of travel) and hotel expenses of the litigants and their witnesses are covered by the show, and the experience is generally treated as an all-expense-paid vacation outside of the actual court case. If there is an exchange of property, Sheindlin signs an order, and a sheriff or marshal oversees the exchange. Sheindlin sees only a half-page complaint and a defense response prior to the taping of the cases, sometimes only moments before. Most of the cases, not including any footage deleted to meet the time constraints of the show, usually last anywhere from twelve to forty-five minutes.",483,0,train
can a runner advance on a dead ball in baseball,"Dead ball -- In baseball, when the ball is dead, no runners may advance beyond the respective bases they are entitled to, and no runners may be put out. The ball becomes dead when:",484,0,train
did over the garden wall win an emmy,"Over the Garden Wall -- Upon its debut, the series received critical acclaim from television critics, with praise focusing on its mood and characters. In 2015, the series won an Emmy Award for Outstanding Animated Program. Outside of the series, a one-shot comic book adaptation penned by McHale has been produced, with four further issues commissioned. This was eventually expanded into an ongoing series.",485,1,train
is ruthie in season 11 of 7th heaven,"7th Heaven (season 11) -- Along with the show's unexpected and last-minute, renewal came some changes. The show's already-low budget was moderately trimmed, forcing cuts in the salaries of some cast members and shortened taping schedules (seven days per episode instead of the typical eight). Furthermore, Mackenzie Rosman, who played youngest daughter Ruthie, did not appear in the first six episodes. Catherine Hicks missed three episodes in season 11, as another cost-cutting move. Additionally, George Stults was absent for a few episodes at the beginning of season 11.",486,1,train
is there a sequel to fantastic beasts and where to find them,"Fantastic Beasts: The Crimes of Grindelwald -- Fantastic Beasts: The Crimes of Grindelwald is an upcoming fantasy drama film produced by Heyday Films and distributed by Warner Bros. Pictures. A co-production of the United Kingdom and the United States, it is the sequel to Fantastic Beasts and Where to Find Them (2016). It will serve as the second film installment in the Fantastic Beasts film series, and the tenth overall in the Wizarding World franchise, which began with the Harry Potter film series. The film is directed by David Yates, with a screenplay by J.K. Rowling, and features an ensemble cast that includes Eddie Redmayne, Katherine Waterston, Dan Fogler, Alison Sudol, Ezra Miller, Johnny Depp, Jude Law, Zoë Kravitz, Callum Turner, Claudia Kim and Carmen Ejogo. The plot follows Newt Scamander and Albus Dumbledore as they attempt to take down the dark wizard Gellert Grindelwald, while facing new threats in a more divided wizarding world.",487,1,train
can you remove venom glands from a snake,"Venomoid -- A venomoid is a venomous snake that has undergone a surgical procedure to remove or inhibit the production of snake venom. This procedure has been used for venomous snakes kept as pets or used in public demonstrations in order to remove the risk of injury or death when handled. The removal of venom glands or fangs of exhibited animals may be by surgery or simple mutilation; some or all of these procedures have been considered illegal and unethical. Removal of fangs is uncommon, as snakes frequently regenerate teeth, and the more invasive procedure of removing the underlying maxillary bone would be fatal. Most venomoid procedures consist of either removing the venom gland itself, or severing the duct between the gland and the fang. However, the duct and gland have been known to regenerate, and supposedly ``safe'' snakes have killed mice and successfully envenomated humans.",488,1,train
do they sell beer in grocery stores in new jersey,"Alcohol laws of New Jersey -- In addition to granting local governments wide latitude over liquor sales, New Jersey law has some other unusual features. Corporations are limited to two retail distribution licenses, making it impractical for chain stores to sell alcoholic beverages; this restriction, in conjunction with municipal ordinances, severely limits supermarket and convenience store chains from selling beer as they do in many other states. State law treats drunk driving as a traffic offense rather than a crime, and permits individual municipalities to define the scope of underage drinking laws.",489,1,train
is the fairmont hotel part of a chain,"Fairmont Hotels and Resorts -- Fairmont Hotels & Resorts is a chain of luxury hotels owned by AccorHotels since 2016. Fairmont Hotels & Resorts was created in 2001 following the merger of Canadian Pacific Hotels (founded in the late 1880s) and Fairmont Hotels (founded in 1907). Fairmont operates 75 properties in 24 countries, with a strong presence in the United States, and Canada.",490,1,train
did bradley cooper sing in a star is botn,"A Star Is Born (2018 film) -- After seeing him perform at Desert Trip festival, Cooper approached Lukas Nelson (son of country music singer Willie Nelson) and asked him to help work on the film. Nelson agreed and wrote several songs, which he sent to the producers. Nelson subsequently met Lady Gaga and began writing songs with her and she, in turn, provided backing vocals on two tracks on his self-titled 2017 album. The soundtrack, performed by Gaga and Cooper, was released on October 5, 2018, by Interscope Records. The studio announced that the album ``features 19 songs in a wide range of musical styles + 15 dialogue tracks that will take you on a journey that mirrors the experience of seeing the film.''",491,1,train
is it possible for a triangle to have more than one obtuse angle,"Acute and obtuse triangles -- An acute triangle is a triangle with all three angles acute (less than 90°). An obtuse triangle is one with one obtuse angle (greater than 90°) and two acute angles. Since a triangle's angles must sum to 180°, no triangle can have more than one obtuse angle.",492,0,train
is one world trade center taller than the empire state building,"List of tallest buildings in New York City -- New York City, the most populous city in the United States, is home to over 6,486 completed high rise buildings of at least 35 meters, of which at least 113 completed are taller than 600 feet (183 m). The tallest building in New York is One World Trade Center, which rises 1,776 feet (541 m). The 104-story skyscraper also stands as the tallest building in the United States, the tallest building in the Western Hemisphere, and the sixth-tallest building in the world. The second-tallest building in the city is 432 Park Avenue, standing at 1,396 feet (426 m), and the third-tallest is the recently-topped-out 30 Hudson Yards. Not counting its antenna, the 4th-tallest is the 102-story Empire State Building in Midtown Manhattan, which was finished in 1931 and rises to 1,250 feet (381 m), increased to 1,454 feet (443 m) by its antenna. It is the fifth-tallest building in the United States and the 37th-tallest building in the world.",493,1,train
has the us ever gone to the world cup,"United States at the FIFA World Cup -- The United States men's national soccer team has played in several World Cup finals, with their best result occurring during their first appearance at the 1930 World Cup, when the United States finished in third place. After the 1950 World Cup, in which the United States upset England in group play 1--0, the U.S. was absent from the finals until 1990. The United States has participated in every World Cup since 1990 until they failed to qualify for the 2018 competition after a loss to Trinidad and Tobago in 2017.",494,1,train
do both feet leave the ground when running,"Running -- Running is a method of terrestrial locomotion allowing humans and other animals to move rapidly on foot. Running is a type of gait characterized by an aerial phase in which all feet are above the ground (though there are exceptions). This is in contrast to walking, where one foot is always in contact with the ground, the legs are kept mostly straight and the center of gravity vaults over the stance leg or legs in an inverted pendulum fashion. A characteristic feature of a running body from the viewpoint of spring-mass mechanics is that changes in kinetic and potential energy within a stride occur simultaneously, with energy storage accomplished by springy tendons and passive muscle elasticity. The term running can refer to any of a variety of speeds ranging from jogging to sprinting.",495,1,train
is estee lauder and clinique the same company,"Estée Lauder Companies -- Estée Lauder's Clinique brand became the first women's cosmetic company to introduce a second line for men when, in 1976, they began a separate line called ``Skin Supplies for Men'', which continues to be sold at Clinique counters worldwide. In 1981, the company's products became available in the Soviet Union.",496,1,train
is charlie from charlie and the chocolate factory still alive,"Peter Ostrum -- Peter Gardner Ostrum (/ˈoʊstrəm/; born November 1, 1957) is an American veterinarian and former child actor whose only film role was as Charlie Bucket in the 1971 motion picture Willy Wonka & the Chocolate Factory.",497,1,train
can you blink one eye at a time,"Blinking -- Some animals, such as tortoises and hamsters, blink their eyes independently of each other. Humans use winking, the blinking of only one eye, as a form of body language.",498,1,train
is the separation of powers in the australian constitution,"Separation of powers in Australia -- Currently, there is no constitutional system where there is a complete separation of powers. The strict doctrine exists only in a theory -- in reality, some overlap is inevitable, though a system of checks and balances has developed. In the Westminster system, ministers (executive) are required to sit in Parliament (legislative). This is to adhere with the concept of Responsible Government. This is also present in the Australian system, being a requirement of section 64 of the Constitution.",499,0,train
do you have to have two license plates in ontario,"Vehicle registration plates of Canada -- In the Canadian provinces and territories of Alberta, Newfoundland and Labrador, the Northwest Territories, Nova Scotia, Nunavut, Prince Edward Island, Quebec, Saskatchewan, and Yukon, licence plates are currently only required on the rear of the vehicle. The remaining provinces, British Columbia, Manitoba, New Brunswick, and Ontario, require the licence plates to be mounted on both the front and rear of the vehicle. Dealership plate frames or custom plate frames are allowed as long as the frame does not obstruct view of validation stickers or district.",500,1,train
are black beans the same as turtle beans,"Black turtle bean -- The black turtle bean is a small, shiny variety of the common bean (Phaseolus vulgaris), especially popular in Latin American cuisine, though it can also be found in Cajun and Creole cuisines of south Louisiana. Like most common beans, they are native to the Americas, but have been introduced around the world. They are also used in East Indian cooking, Punjabi cuisine and are referred to as black beans and in Maharshtrian cuisine known as ``Kala Ghevada''. They are used interchangeably with vigna mungo in countries such as the US. They are often simply called black beans (frijoles negros, zaragoza, judía negra, poroto negro, caraota o habichuela negra in Spanish, and feijão preto in Portuguese), although this can cause confusion with other black beans.",501,1,train
is a wooly mammoth the same as a mastodon,"Mastodon -- Modern reconstructions based on partial and skeletal remains reveal that mastodons were very similar in appearance to elephants and, to a lesser degree, mammoths, though not closely related to either one. Compared to mammoths, mastodons had shorter legs, a longer body and were more heavily muscled, a build similar to that of the current Asian elephants. The average body size of the species M. americanum was around 2.3 m (7 ft 7 in) in height at the shoulders, corresponding to a large female or a small male; large males were up to 2.8 m (9 ft 2 in) in height. Among the largest male specimens, the 35-year-old AMNH 9950 was 2.89 metres (9.5 ft) tall and weighed 7.8 tonnes (7.7 long tons; 8.6 short tons), while another was 3.25 metres (10.7 ft) tall and weighed 11 tonnes (11 long tons; 12 short tons).",502,0,train
is carling black label a south african beer,"Carling Black Label -- Black Label is a Canadian brand of lager distributed by Carling and well-known throughout the former British Empire. In several countries, it is also known as Carling Black Label, and in Sweden, it is known as Carling Premier. In the United Kingdom it is now known as just Carling.",503,0,train
were the world trade centers the tallest buildings in america,"World Trade Center (1973–2001) -- The original World Trade Center was a large complex of seven buildings in Lower Manhattan, New York City, United States. It featured the landmark twin towers, which opened on April 4, 1973, and were destroyed as a result of the September 11 attacks in 2001. At the time of their completion, the ``Twin Towers''--the original 1 World Trade Center, at 1,368 feet (417 m); and 2 World Trade Center, at 1,362 feet (415.1 m)--were the tallest buildings in the world. The other buildings in the complex included the Marriott World Trade Center (3 WTC), 4 WTC, 5 WTC, 6 WTC, and 7 WTC. All these buildings were built between 1975 and 1985, with a construction cost of $400 million ($2,300,000,000 in 2014 dollars). The complex was located in New York City's Financial District and contained 13,400,000 square feet (1,240,000 m) of office space.",504,1,train
is there still an east and west berlin,"West Berlin -- On 9 November 1989, the Wall was opened, and the two parts of the city were once again physically--though at this point not legally--united. The Two Plus Four Treaty, signed by the two German states and the four wartime allies, paved the way for German reunification and an end to the Western Allies' occupation of West Berlin. On 3 October 1990--the day Germany was officially reunified--East and West Berlin formally reunited as the city of Berlin, which then joined the enlarged Federal Republic as a city-state along the lines of the existing West German city-states of Bremen and Hamburg. Walter Momper, the mayor of West Berlin, became the first mayor of the reunified city.",505,0,train
can i carry a gun in my car south carolina,"Gun laws in South Carolina -- South Carolina is a ``shall issue'' concealed carry permit state. No permit is required to purchase rifles, shotguns, or handguns. South Carolina also has ``Castle Doctrine'' legal protection of the use of deadly force against intruders into one's home, business, or car. It is unlawful to carry a firearm onto private or public school property or into any publicly owned building except interstate rest areas without express permission. Open carry of a handgun is not allowed (long guns are allowed), but no permit is required to carry a loaded handgun in the console or glove compartment of a car. As of 3 June 2016, states with which South Carolina has reciprocity are: Alaska, Arizona, Arkansas, Florida, Georgia, Idaho (enhanced permit only), Kansas, Kentucky, Louisiana, Michigan, Missouri, New Mexico, North Carolina, North Dakota, Ohio, Oklahoma, South Dakota (enhanced permit only), Texas, Tennessee, Virginia, West Virginia, and Wyoming. South Carolina only recognizes resident permits from the states with which it has reciprocity; non-resident permits from those states will not be honored. South Carolina does issue a CCW permit to a non-resident from a non-reciprocal state only if the non-resident owns real property in South Carolina as per Title 23 Chapter 31 Article 4 Section 23-31-210",506,1,train
does every player get their name on the stanley cup,"Stanley Cup -- Unlike the trophies awarded by the other major professional sports leagues of North America, a new Stanley Cup is not made each year. Originally, the winners kept it until a new champion was crowned. Currently, winning teams get the Stanley Cup during the summer and a limited number of days during the season. It is unusual among trophies to include winning members' names. Every year since 1924, a select portion of the winning players, coaches, management, and club staff names are engraved on its bands. However, there is not enough room to include all the players and non-players, so some names must be omitted. Between 1924 and 1940, a new band was added almost every year the trophy was awarded, earning the nickname ``Stovepipe Cup'' due to the unnatural height of all the bands. In 1947 the cup size was reduced, but not all the large rings were the same size. In 1958 the modern one-piece Cup was designed with a five-band barrel which could contain 13 winning teams per band. To prevent the Stanley Cup from growing, when the bottom band is full, the oldest band is removed and preserved in the Hockey Hall of Fame, and a new blank band added to the bottom. It has been referred to as The Cup, Lord Stanley's Cup, The Holy Grail, or facetiously (chiefly by sportswriters) as Lord Stanley's Mug. The Stanley Cup is surrounded by numerous legends and traditions, the oldest of which is the celebratory drinking of champagne out of the cup by the winning team.",507,0,train
is stanley cup 2-3-2,"Stanley Cup playoffs -- The Stanley Cup playoffs consists of four rounds of best-of-seven series. Each series is played in a 2--2--1--1--1 format, meaning the team with home-ice advantage hosts games one, two, five, and seven, while their opponent hosts games three, four, and six. Games five, six, and seven are only played if needed.",508,0,train
is it illegal to kill a slow worm,"Anguis fragilis -- In the United Kingdom, the slowworm has been granted protected status, alongside all other native British reptile species. The slowworm has been decreasing in numbers, and under the Wildlife and Countryside Act 1981, it is illegal to intentionally kill, injure, sell or advertise to sell them.",509,1,train
is a toyota kluger the same as a highlander,"Toyota Highlander -- The Toyota Highlander (Japanese: トヨタ ハイランダー, Toyota Hairandā), also known as the Toyota Kluger (Japanese: トヨタ クルーガー, Toyota Kurūgā), is a mid-size crossover SUV produced by Toyota. It is built on the same platform as used on the Toyota Camry, but based on size of the Toyota Avalon chassis.",510,1,train
has croatia ever won a world cup final,"Croatia at the FIFA World Cup -- Croatia national football team have appeared in the FIFA World Cup on five occasions (in 1998, 2002, 2006, 2014 and 2018) since gaining independence in 1991. Before that, from 1930 to 1990 Croatia was part of Yugoslavia. Their best result thus far was silver position at the 2018 final, where they lost 4-2 to France.",511,0,train
is the book of mark in the new testament,"Gospel of Mark -- The Gospel According to Mark (Greek: τὸ κατὰ Μᾶρκον εὐαγγέλιον, to kata Markon euangelion), the second book of the New Testament, is one of the four canonical gospels and one of the three synoptic gospels. It tells of the ministry of Jesus from his baptism by John the Baptist to his death and burial and the discovery of the empty tomb -- there is no genealogy of Jesus or birth narrative, nor, in the original ending at chapter 16, any post-resurrection appearances. It portrays Jesus as a heroic man of action, an exorcist, a healer, and a miracle worker. Jesus is also the Son of God, but he keeps his identity secret, concealing it in parables so that even the disciples fail to understand. All this is in keeping with prophecy, which foretold the fate of the messiah as suffering servant. The gospel ends, in its original version, with the discovery of the empty tomb, a promise to meet again in Galilee, and an unheeded instruction to spread the good news of the resurrection.",512,1,train
will there be a third season of bed of roses,"Bed of Roses (TV series) -- Season Three began filming in May 2010. the program was filmed over five months in regional Victoria (South Gippsland), Melbourne and in the ABC TV studios, Southbank. For the second time the number of episodes will increase, with Season 3 to have 12 episodes and will begin airing 4 December 2010.",513,1,train
