question,passage,idx,label,ds_type
do iran and afghanistan speak the same language,"Persian language -- Persian (/ˈpɜːrʒən, -ʃən/), also known by its endonym Farsi (فارسی fārsi (fɒːɾˈsiː) ( listen)), is one of the Western Iranian languages within the Indo-Iranian branch of the Indo-European language family. It is primarily spoken in Iran, Afghanistan (officially known as Dari since 1958), and Tajikistan (officially known as Tajiki since the Soviet era), and some other regions which historically were Persianate societies and considered part of Greater Iran. It is written in the Persian alphabet, a modified variant of the Arabic script, which itself evolved from the Aramaic alphabet.",0,1,train
do good samaritan laws protect those who help at an accident,"Good Samaritan law -- Good Samaritan laws offer legal protection to people who give reasonable assistance to those who are, or who they believe to be, injured, ill, in peril, or otherwise incapacitated. The protection is intended to reduce bystanders' hesitation to assist, for fear of being sued or prosecuted for unintentional injury or wrongful death. An example of such a law in common-law areas of Canada: a good Samaritan doctrine is a legal principle that prevents a rescuer who has voluntarily helped a victim in distress from being successfully sued for wrongdoing. Its purpose is to keep people from being reluctant to help a stranger in need for fear of legal repercussions should they make some mistake in treatment. By contrast, a duty to rescue law requires people to offer assistance and holds those who fail to do so liable.",1,1,train
is windows movie maker part of windows essentials,"Windows Movie Maker -- Windows Movie Maker (formerly known as Windows Live Movie Maker in Windows 7) is a discontinued video editing software by Microsoft. It is a part of Windows Essentials software suite and offers the ability to create and edit videos as well as to publish them on OneDrive, Facebook, Vimeo, YouTube, and Flickr.",2,1,train
is confectionary sugar the same as powdered sugar,"Powdered sugar -- Powdered sugar, also called confectioners' sugar, icing sugar, and icing cake, is a finely ground sugar produced by milling granulated sugar into a powdered state. It usually contains a small amount of anti-caking agent to prevent clumping and improve flow. Although most often produced in a factory, powdered sugar can also be made by processing ordinary granulated sugar in a coffee grinder, or by crushing it by hand in a mortar and pestle.",3,1,train
is elder scrolls online the same as skyrim,"The Elder Scrolls Online -- As with other games in The Elder Scrolls series, the game is set on the continent of Tamriel. The events of the game occur a millennium before those of The Elder Scrolls V: Skyrim and around 800 years before The Elder Scrolls III: Morrowind and The Elder Scrolls IV: Oblivion. It has a broadly similar structure to Skyrim, with two separate conflicts progressing at the same time, one with the fate of the world in the balance, and one where the prize is supreme power on Tamriel. In The Elder Scrolls Online, the first struggle is against the Daedric Prince Molag Bal, who is attempting to meld the plane of Mundus with his realm of Coldharbour, and the second is to capture the vacant imperial throne, contested by three alliances of the mortal races. The player character has been sacrificed to Molag Bal, and Molag Bal has stolen their soul, the recovery of which is the primary game objective.",4,0,train
can you use oyster card at epsom station,Epsom railway station -- Epsom railway station serves the town of Epsom in Surrey. It is located off Waterloo Road and is less than two minutes' walk from the High Street. It is not in the London Oyster card zone unlike Epsom Downs or Tattenham Corner stations. The station building was replaced in 2012/2013 with a new building with apartments above the station (see end of article).,5,0,train
will there be a season 4 of da vinci's demons,"Da Vinci's Demons -- The series premiered in the United States on Starz on 12 April 2013, and its second season premiered on 22 March 2014. The series was renewed for a third season, which premiered on 24 October 2015. On 23 July 2015, Starz announced that the third season would be the show's last. However Goyer has left it open for a miniseries return.",6,0,train
is the federal court the same as the supreme court,"Federal judiciary of the United States -- The federal courts are composed of three levels of courts. The Supreme Court of the United States is the court of last resort. It is generally an appellate court that operates under discretionary review, which means that the Court can choose which cases to hear, by granting writs of certiorari. There is therefore generally no basic right of appeal that extends automatically all the way to the Supreme Court. In a few situations (like lawsuits between state governments or some cases between the federal government and a state) it sits as a court of original jurisdiction.",7,0,train
did abraham lincoln write the letter in saving private ryan,"Bixby letter -- In the 1998 war film Saving Private Ryan, General George Marshall (played by Harve Presnell) reads the Bixby letter to his officers before giving the order to find and send home Private James Francis Ryan after Ryan's three brothers died in battle.",8,1,train
is batman and robin a sequel to batman forever,"Batman & Robin (film) -- With the box office success of Batman Forever in June 1995, Warner Bros. immediately commissioned a sequel. They hired director Joel Schumacher and writer Akiva Goldsman to reprise their duties the following August, and decided it was best to fast track production for a June 1997 target release date, which is a break from the usual 3-year gap between films. Schumacher wanted to homage both the broad camp style of the 1960s television series and the work of Dick Sprang. The storyline of Batman & Robin was conceived by Schumacher and Goldsman during pre-production on A Time to Kill. Portions of Mr. Freeze's back-story were based on the Batman: The Animated Series episode ``Heart of Ice'', written by Paul Dini.",9,1,train
is a wolverine the same as a badger,"Badger -- Badgers are short-legged omnivores in the family Mustelidae, which also includes the otters, polecats, weasels, and wolverines. They belong to the caniform suborder of carnivoran mammals. The 11 species of badgers are grouped in three subfamilies: Melinae (Eurasian badgers), Mellivorinae (the honey badger or ratel), and Taxideinae (the American badger). The Asiatic stink badgers of the genus Mydaus were formerly included within Melinae (and thus Mustelidae), but recent genetic evidence indicates these are actually members of the skunk family, placing them in the taxonomic family Mephitidae.",10,0,train
will there be a green lantern 2 movie,"Green Lantern (film) -- Green Lantern was released on June 17, 2011, and received generally negative reviews; most criticized the film for its screenplay, inconsistent tone, choice and portrayal of villains, and its use of CGI, while some praised Reynolds' performance. Reynolds would later voice his dissatisfaction with the film. The film underperformed at the box office, grossing $219 million against a production budget of $200 million. Due to the film's negative reception and disappointing box office performance, Warner Bros. canceled any plans for a sequel, instead opting to reboot the character in the DC Extended Universe line with the film Green Lantern Corps, set for release in 2020.",11,0,train
does the icc has jurisdiction in the united states,"United States and the International Criminal Court -- The United States should have the chance to observe and assess the functioning of the court, over time, before choosing to become subject to its jurisdiction. Given these concerns, I will not, and do not recommend that my successor, submit the treaty to the Senate for advice and consent until our fundamental concerns are satisfied.",12,0,train
calcium carbide cac2 is the raw material for the production of acetylene,Calcium carbide -- Calcium carbide is a chemical compound with the chemical formula of CaC. Its main use industrially is in the production of acetylene and calcium cyanamide.,13,1,train
is there a now you see me 3 coming out,"Now You See Me (film series) -- Now You See Me is a series of heist thriller film written by Ed Solomon, Boaz Yakin, and Edward Ricourt. They focus on the actions of a team of illusionists named ``The Four Horsemen'' who pull off near impossible heists. The series features an ensemble cast including Jesse Eisenberg, Mark Ruffalo, Woody Harrelson, Isla Fisher, Dave Franco, Michael Caine, Lizzy Caplan, and Morgan Freeman. The first film was released in 2013, while the second was released in 2016, and a third film is currently in development and set to be released in 2019. The series has received mixed reviews from critics and audiences and grossed nearly $700 million worldwide.",14,1,train
does a penalty shoot out goal count towards the golden boot,"Penalty shoot-out (association football) -- A shoot-out is usually considered for statistical purposes to be separate from the match which preceded it. In the case of a two-legged fixture, the two matches are still considered either as two draws or as one win and one loss; in the case of a single match, it is still considered as a draw. This contrasts with a fixture won in extra time, where the score at the end of normal time is superseded. Converted shoot-out penalties are not considered as goals scored by a player for the purposes of their individual records, or for ``golden boot'' competitions.",15,0,train
will there be a new season of cutthroat kitchen,"Cutthroat Kitchen -- Cutthroat Kitchen is a cooking show hosted by Alton Brown that aired on the Food Network from August 11, 2013 to July 19, 2017. It features four chefs competing in a three-round elimination cooking competition. The contestants face auctions in which they can purchase opportunities to sabotage one another. Each chef is given $25,000 at the start of the show; the person left standing keeps whatever money they have not spent in the auctions. The show ended on its fifteenth season in July 2017. The series shares some basic elements with other four-chef, three-round elimination-style competitions on Food Network including Chopped and Guy's Grocery Games. Numerous Cutthroat Kitchen contestants have competed on these shows.",16,0,train
is jack sikma in the hall of fame,"Jack Sikma -- In 2006, Sikma was voted as one of the 100 Legends of the IHSA Boys Basketball Tournament, a group of former players and coaches in honor of the 100 anniversary of the IHSA boys basketball tournament. On June 27, 2017, Sikma was inducted into the Small College Basketball Hall of Fame as part of their second class . Inducted alongside Sikma were Zelmo Beaty, Walt Frazier, Bob Love, Elmore Smith, Jim Spivey, Rico Swanson, George Tinsley, and Al Tucker.",17,1,train
can elves and humans mate lord of the rings,"Half-elven -- In J.R.R. Tolkien's fictional universe of Middle-earth, the Half-elven (Sindarin singular Peredhel, plural Peredhil, Quenya singular Perelda) are the children of the union of Elves and Men. Of these, the most significant were the products of couplings between the Eldar (the Elves who followed the Call to Valinor) and the Edain (the Men of the Three Houses of early Men who allied themselves with the Eldar in their war against Morgoth).",18,1,train
the boy in the plastic bubble based on true story,"The Boy in the Plastic Bubble -- The Boy in the Plastic Bubble is a 1976 American made-for-television drama film inspired by the lives of David Vetter and Ted DeVita, who lacked effective immune systems. It stars John Travolta, Glynnis O'Connor, Diana Hyland, Robert Reed, Ralph Bellamy & P.J. Soles. It was written by Douglas Day Stewart, executive produced by Aaron Spelling and Leonard Goldberg (who, at the time, produced Starsky and Hutch and Charlie's Angels), and directed by Randal Kleiser, who would work with Travolta again in Grease shortly after. The original music score was composed by Mark Snow. The theme song ``What Would They Say'' was written and sung by Paul Williams. William Howard Taft High School in Woodland Hills was used for filming.",19,1,train
science begins with the premise that knowledge should first be acquired through observation,"A priori and a posteriori -- These terms are used with respect to reasoning (epistemology) to distinguish ``necessary conclusions from first premises'' (i.e., what must come before sense observation) from ``conclusions based on sense observation'' (which must follow it). Thus, the two kinds of knowledge, justification, or argument, may be glossed:",20,1,train
is tim brown in the hall of fame,"Tim Brown (American football) -- Timothy Donell Brown (born July 22, 1966) is a former American football wide receiver who played professionally in the National Football League (NFL). He played college football for Notre Dame, where he won the Heisman Trophy, becoming the first wide receiver to win the award. He spent sixteen years with the Los Angeles/Oakland Raiders, during which he established himself as one of the NFL's most prolific wide receivers. Brown has also played for the Tampa Bay Buccaneers. In 2015, he was inducted into the Pro Football Hall of Fame.",21,1,train
can you drink alcohol in public in denmark,Drinking in public -- Drinking in public in Denmark is legal in general. The law forbids ``disturbing of the public law and order''. Thus general consumption is accepted. Several cafes have outdoor serving in the same zones.,22,1,train
is jersey currency legal tender in the uk,"Jersey pound -- Both Jersey and Bank of England notes are legal tender in Jersey and circulate together, alongside the Guernsey pound and Scottish banknotes. The Jersey notes are not legal tender in the United Kingdom but are legal currency, so creditors and traders may accept them if they so choose.",23,0,train
have the milwaukee bucks ever won a championship,"Milwaukee Bucks -- The Bucks have won one league title (1971), two conference titles (1971 and 1974), and 13 division titles (1971--1974, 1976, 1980--1986, 2001). They have featured such notable players as Kareem Abdul-Jabbar, Sidney Moncrief, Oscar Robertson, Bob Dandridge, Bob Lanier, Glenn Robinson, Ray Allen, Sam Cassell, Junior Bridgeman, Michael Redd, Terry Cummings, Vin Baker, Jon McGlocklin, Marques Johnson, and Brian Winters.",24,1,train
does the world cup final go to penalties,"List of FIFA World Cup penalty shoot-outs -- This is a list of all penalty shoot-outs that have occurred in the Finals tournament of the FIFA World Cup. Penalty shoot-outs were introduced as tie-breakers in the 1978 World Cup but did not occur before 1982. The first time a World Cup title was won by penalty shoot-out was in 1994. The only other time was in 2006. By the end of the 2018 edition, 30 shoot-outs have taken place in the World Cup. Of these, only two reached the sudden death stage after still being tied at the end of ``best of five kicks''.",25,1,train
is kingdom manga based on a true story,"Kingdom (manga) -- Kingdom (キングダム, Kingudamu) is a Japanese manga series written and illustrated by Yasuhisa Hara (原泰久, Hara Yasuhisa). The manga provides a fictionalized account of the Warring States period primarily through the experiences of the war orphan Xin and his comrades as he fights to become the greatest general under the heavens, and in doing so, unifying China for the first time in history. The series was adapted into a thirty-eight episode anime series by studio Pierrot that aired from June 4, 2012 to February 25, 2013. A second season was announced and aired from June 8, 2013 to March 1, 2014. An English language release of the anime was licensed by Funimation.",26,1,train
is croatia part of the european economic area,"European Economic Area -- As of 2014 the contracting parties to the EEA are 3 of the 4 EFTA member states and 27 of the 28 EU member states. The 28th and newest EU member, Croatia, finished negotiating their accession to the EEA in November 2013, and since 12 April 2014 is provisionally applying the agreement pending its ratification by all EEA member states.",27,1,train
can u marry a dead person in france,"Posthumous marriage -- Posthumous marriage (or necrogamy) is a marriage in which one of the participating members is deceased. It is legal in France and similar forms are practiced in Sudan and China. Since World War I, France has had hundreds of requests each year, of which many have been accepted.",28,1,train
is saline and sodium chloride the same thing,"Saline (medicine) -- Saline, also known as saline solution, is a mixture of sodium chloride in water and has a number of uses in medicine. Applied to the affected area it is used to clean wounds, help remove contact lenses, and help with dry eyes. By injection into a vein it is used to treat dehydration such as from gastroenteritis and diabetic ketoacidosis. It is also used to dilute other medications to be given by injection.",29,0,train
is there a treatment for the bubonic plague,"Bubonic plague -- Several classes of antibiotics are effective in treating bubonic plague. These include aminoglycosides such as streptomycin and gentamicin, tetracyclines (especially doxycycline), and the fluoroquinolone ciprofloxacin. Mortality associated with treated cases of bubonic plague is about 1--15%, compared to a mortality of 40--60% in untreated cases.",30,1,train
does buffy's mom know she's a slayer,"Joyce Summers -- The premise of the series is that Buffy is the latest Slayer, a young woman endowed by mystical forces with superhuman powers to fight and defeat vampires, demons, and other evil forces in the fictional town of Sunnydale. Like every Slayer before her, she was chosen and informed of her destiny when she was 15 years old. Her mother is unaware of her daughter's powers and responsibilities until Buffy is forced to tell her at the end of the second season of the television series. Although Joyce is shocked at this revelation, she recovers quickly and remains a source of stability for Buffy and Buffy's small circle of friends who assist her, dubbed the Scooby Gang. Eventually Joyce is able to take Buffy's dangerous demon-fighting in stride and even become proud and respectful of her daughter's abilities. Her natural death from an illness in the fifth season forces Buffy to face becoming an adult.",31,1,train
was the leaning tower of pisa built leaning,"Leaning Tower of Pisa -- The tower's tilt began during construction in the 12th century, caused by an inadequate foundation on ground too soft on one side to properly support the structure's weight. The tilt increased in the decades before the structure was completed in the 14th century. It gradually increased until the structure was stabilized (and the tilt partially corrected) by efforts in the late 20th and early 21st centuries.",32,0,train
is the movie fool's gold a true story,Fool's Gold (2008 film) -- Fool's Gold is a 2008 American adventure-romance film from Warner Bros. Pictures about a recently divorced couple who rekindle their romantic life while searching for a lost treasure. The film was directed by Andy Tennant and reunites the How to Lose a Guy in 10 Days stars Matthew McConaughey and Kate Hudson.,33,0,train
has any nfl team played the superbowl at home,"Super Bowl curse -- The home field curse affects the host team of the Super Bowl. So far no team has yet managed to reach the Super Bowl in their home stadium. Four teams with Super Bowls in their home venue have qualified for the divisional playoffs: the 1994 Miami Dolphins, the 1998 Miami Dolphins, the 2016 Houston Texans, and the 2017 Minnesota Vikings, the Vikings being the first to qualify for their conference's title game. From 1966--2011 (excluding the six Super Bowl games held in a stadium without a professional team), the Super Bowl host team has had 11 winning seasons, four split seasons, and 25 losing seasons. Mathematically, the probability of that many losing seasons or more occurring by chance (assuming a 50 percent chance of having a losing season (disregarding .500 seasons)) is 7.69 percent. It should be noted, however, that the Super Bowl host stadium is selected several years before the game is played, without regard to the teams that qualify.",34,0,train
does each australian state have its own constitution,"State constitution (Australia) -- In Australia, each state has its own constitution. Each state constitution preceded the Constitution of Australia as constitutions of the then separate British colonies, but all the states ceded powers to the Parliament of Australia as part of federation in 1901.",35,1,train
can you have a right and left bundle branch block,"Bundle branch block -- A bundle branch block can be diagnosed when the duration of the QRS complex on the ECG exceeds 120 ms. A right bundle branch block typically causes prolongation of the last part of the QRS complex, and may shift the heart's electrical axis slightly to the right. The ECG will show a terminal R wave in lead V1 and a slurred S wave in lead I. Left bundle branch block widens the entire QRS, and in most cases shifts the heart's electrical axis to the left. The ECG will show a QS or rS complex in lead V1 and a monophasic R wave in lead I. Another normal finding with bundle branch block is appropriate T wave discordance. In other words, the T wave will be deflected opposite the terminal deflection of the QRS complex. Bundle branch block, especially left bundle branch block, can lead to cardiac dyssynchrony. The simultaneous occurrence of left and right bundle branch block leads to total AV block.",36,1,train
do you always have to say check in chess,"Check (chess) -- In informal games, it is customary to announce ``check'' when making a move that puts the opponent's king in check. In formal competitions, however, check is rarely announced.",37,0,train
is an australian shepherd the same as an australian cattle dog,"Australian Cattle Dog -- The Texas Heeler is a cross between the Australian Cattle Dog and the Australian Shepherd that was first registered with the Animal Research Foundation (ARF) in 1970. The ARF has registered Australian Cattle Dogs without papers as ``Australian Cattledog Queensland Heelers'' since 1965 and was the first organisation to recognise the Australian Shepherd. Although originally bred for its ability to work cattle, the Texas Heeler is increasingly used as a pet and a companion in dog sports. As with most cross breeds, the Texas Heeler's size and appearance is a variable combination of the parent breeds.",38,0,train
is tomato puree and tomato sauce the same thing,"Tomato purée -- Tomato purée is a thick liquid made by cooking and straining tomatoes. The difference between tomato paste, tomato purée, and tomato sauce is consistency; tomato puree has a thicker consistency and a deeper flavour than sauce.",39,0,train
is the blues brothers based on a true story,"The Blues Brothers -- The Blues Brothers are an American blues and soul revivalist band which was founded in 1978 by comedy actors Dan Aykroyd and John Belushi as part of a musical sketch on Saturday Night Live. Belushi and Aykroyd fronted the band, respectively in character as lead vocalist ``Joliet'' Jake Blues and harmonica player/vocalist Elwood Blues. The band was composed of well-known and respected musicians, and debuted as the musical guest on the April 22, 1978, episode of Saturday Night Live, opening the show performing ``Hey Bartender'', and later ``Soul Man''.",40,0,train
is newcastle upon tyne the same as newcastle,"Newcastle upon Tyne -- Newcastle upon Tyne (locally /njuːˈkæsəl/ ( listen)), commonly known as Newcastle, is a city in Tyne and Wear, North East England, 103 miles (166 km) south of Edinburgh and 277 miles (446 km) north of London on the northern bank of the River Tyne, 8.5 mi (13.7 km) from the North Sea. Newcastle is the most populous city in the North East, and forms the core of the Tyneside conurbation, the eighth most populous urban area in the United Kingdom. Newcastle is a member of the English Core Cities Group and is a member of the Eurocities network of European cities.",41,1,train
is post office and royal mail the same,"Post Office Ltd -- The Post Office provides information on services and accepts postal items and payment on behalf of the two collection and delivery divisions of Royal Mail Group, Royal Mail and Parcelforce. These include a variety of ordinary and guaranteed services both for delivery within the United Kingdom and to international destinations. Postage stamps (including commemorative stamps and other philatelic items) are sold, while applications for redirection of mail are accepted on behalf of Royal Mail.",42,0,train
has any supreme court nominee not been confirmed,"Unsuccessful nominations to the Supreme Court of the United States -- Justices are nominated by the president and then confirmed by the U.S. Senate. A nomination to the Court is considered to be official when the Senate receives a signed nomination letter from the president naming the nominee, which is then entered in the Senate's record. There have been 37 unsuccessful nominations to the Supreme Court of the United States. Of these, 11 nominees were rejected in Senate roll-call votes, 11 were withdrawn by the president, and 15 lapsed at the end of a session of Congress. Six of these unsuccessful nominees were subsequently nominated and confirmed to other seats on the Court. Additionally, although confirmed, seven nominees either declined office or (in one instance) died before assuming office.",43,1,train
