question,passage,idx,label,ds_type
did the berlin wall go all around west berlin,"Berlin Wall -- The Berlin Wall (German: Berliner Mauer, pronounced (bɛʁˈliːnɐ ˈmaʊ̯ɐ) ( listen)) was a guarded concrete barrier that physically and ideologically divided Berlin from 1961 to 1989. Constructed by the German Democratic Republic (GDR, East Germany), starting on 13 August 1961, the Wall cut off (by land) West Berlin from virtually all of surrounding East Germany and East Berlin until government officials opened it in November 1989. Its demolition officially began on 13 June 1990 and finished in 1992. The barrier included guard towers placed along large concrete walls, accompanied by a wide area (later known as the ``death strip'') that contained anti-vehicle trenches, ``fakir beds'' and other defenses. The Eastern Bloc portrayed the Wall as protecting its population from fascist elements conspiring to prevent the ``will of the people'' in building a socialist state in East Germany.",750,0,train
is mr stark in captain america related to iron man,"Howard Stark -- Described as a sarcastic scientist and ruthless businessman, Howard worked alongside his father on various projects, and later founded Stark Industries. Howard was an inventive mechanical engineering prodigy, constantly creating new technology and looking for ways to improve it. He designed and built weaponry and devices that have revolutionized the industrial world, such as various technologies used by S.H.I.E.L.D. and its allies. Howard later had a wife and they had their child Tony. Howard's relationship with Tony was a difficult one, however, with Howard rarely expressing affection for the boy. Howard's one major weakness was his severe case of alcoholism, a problem Tony himself would inherit. In the comics, Howard and his wife died in a car crash, as the result of faulty brakes arranged by either business competitors Republic Oil & Gas or by the V-Battalion. Howard's death inspired his son to take both business and engineering seriously as Iron Man.",751,1,train
is the movie the matrix based on a book,"The Matrix -- The Matrix is a 1999 science fiction action film written and directed by The Wachowski Brothers and starring Keanu Reeves, Laurence Fishburne, Carrie-Anne Moss, Hugo Weaving, and Joe Pantoliano. It depicts a dystopian future in which reality as perceived by most humans is actually a simulated reality called ``the Matrix'', created by sentient machines to subdue the human population, while their bodies' heat and electrical activity are used as an energy source. Cybercriminal and computer programmer Neo learns this truth and is drawn into a rebellion against the machines, which involves other people who have been freed from the ``dream world.''",752,0,train
can there be an economy without economic problem,"Economic problem -- The economic problem is most simply explained by the question: ``How do we satisfy unlimited wants with limited resources?'' The premise of the economic problem model is that wants are constant and infinite due to constantly changing demands (often closely related to changing demographics of the population), but resources in the world to satisfy human wants are always limited to the amount of natural or human resources available. The economic problem and methods to curb it--revolve around the idea of choice in prioritizing which wants can be fulfilled and what to produce for the economy.",753,0,train
did the movie dolores claiborne win any awards,Dolores Claiborne (film) -- Kathy Bates and Jennifer Jason Leigh were nominated for the best actress and best supporting actress award at the 22nd Saturn Awards. Ellen Muth also won the Tokyo International Film Festival Award for Best Supporting Actress.,754,1,train
did the cast of full house really go to hawaii,"Full House -- Although the series was set in San Francisco, the sitcom itself was taped at the Warner Bros. Studios in Los Angeles. Outside of certain excerpts in the opening title sequences, including Alamo Square Park's Painted Ladies, the only episode to have actually been taped in San Francisco was the first episode of season eight, ``Comet's Excellent Adventure''. There were also a few episodes which were filmed on-location elsewhere, most notably Hawaii in the season three premiere ``Tanner's Island'', and at Walt Disney World for the two-part sixth-season finale ``The House Meets the Mouse''.",755,1,train
are bass pro shops and cabelas owned by the same company,"Bass Pro Shops -- In October 2016, Bass Pro Shops announced that they had reached a deal to acquire competitor Cabela's for $5.5 billion. The deal is being financed via preferred equity financing from Goldman Sachs and Pamplona. Goldman Sachs will contribute $1.8 billion towards financing and Pamplona will contribute the remainder for a total commitment of $2.4 billion. The new entity is expected to be formed and in operation in Q1 or Q2 of 2017. The new entity will keep Cabela's base in Sidney and Lincoln, Nebraska. Morris will continue as CEO of the new entity. He will also be the majority shareholder of the new privately held entity. Tommy Milner stressed that the company had reviewed a range of options that would maximize value, with the board choosing to go the route of Bass Pro Shops.",756,1,train
do you have to pay for a warning ticket,"Warning (traffic stop) -- When a traffic stop is made, a warning issued by the officer is a statement that the motorist has committed some offense, but is being spared the actual citation. Officers use their own discretion whether to issue a citation or warning. The motorist may receive the warning either verbally or written, but will not be charged with the offense, will not have to pay a fine, and will not receive any points. Depending on the laws of the jurisdiction, the warning may or may not appear on records visible to officers, which, if it does, could result in another stop within a fixed period of time leading to an actual citation, or in some cases, the motorist may be charged with both offenses.",757,0,train
can a world cup final go to penalties,"List of FIFA World Cup penalty shoot-outs -- This is a list of all penalty shoot-outs that have occurred in the Finals tournament of the FIFA World Cup. Penalty shoot-outs were introduced as tie-breakers in the 1978 World Cup but did not occur before 1982. The first time a World Cup title was won by penalty shoot-out was in 1994. The only other time was in 2006. By the end of the 2018 edition, 30 shoot-outs have taken place in the World Cup. Of these, only two reached the sudden death stage after still being tied at the end of ``best of five kicks''.",758,1,train
in glee season 1 do they win sectionals,"Sectionals -- ``Sectionals'' is the thirteenth episode of the American television series Glee. It premiered on the Fox network on December 9, 2009. The episode was written and directed by series co-creator Brad Falchuk, and serves as the mid-season finale for the show's first season. ``Sectionals'' sees the glee club win the sectionals round of competition, advancing on to regionals. Glee club member Finn (Cory Monteith) discovers he is not the father of his girlfriend Quinn's (Dianna Agron) baby. Football coach Ken Tanaka (Patrick Gallagher) plans his wedding with Emma (Jayma Mays) on the same day as the sectionals competition. Will Schuester (Matthew Morrison) is unable to take the students to sectionals and Emma offers to take them. The episode sees the return of Eve and Michael Hitchcock as rival glee club directors Grace Hitchens and Dalton Rumba.",759,1,train
did the movie papillon win any academy awards,"Papillon (1973 film) -- In 1974, the film was nominated for an Oscar for Best Music, Original Dramatic Score (Jerry Goldsmith) and a Golden Globe Award for Best Motion Picture Actor, Drama (Steve McQueen).",760,0,train
is qatar going to be the world cup host,"Qatar 2022 FIFA World Cup bid -- President of FIFA Sepp Blatter endorsed the idea of having a World Cup in the Arab World, saying in April 2010: ``The Arabic world deserves a World Cup. They have 22 countries and have not had any opportunity to organize the tournament''. Blatter also praised Qatar's progress: ``When I was first in Qatar there were 400,000 people here and now there are 1.6 million. In terms of infrastructure, when you are able to organise the Asian Games (in 2006) with more than 30 events for men and women, then that is not in question''. On 2 December 2010, it was announced that Qatar will host the 2022 FIFA World Cup.",761,1,train
has willie robertson from duck dynasty passed away,"Willie Robertson -- Willie Jess Robertson (born April 22, 1972) is an American TV personality, businessman, outdoorsman, hunter, author, and actor. He is best known for his appearances on the reality TV series Duck Dynasty on A&E, and is the current CEO of the company Duck Commander. Robertson lives in West Monroe, Louisiana with his wife Korie and his children: John Luke, Sadie, Will, Rowdy, Bella, and Rebecca.",762,0,train
the truth in lending act regulates interest rates and the terms of loans,"Truth in Lending Act -- TILA also gives consumers the right to cancel certain credit transactions that involve a lien on a consumer's principal dwelling, regulates certain credit card practices, and provides a means for fair and timely resolution of credit billing disputes. With the exception of certain high-cost mortgage loans, TILA does not regulate the charges that may be imposed for consumer credit. Rather, it requires uniform or standardized disclosure of costs and charges so that consumers can shop. It also imposes limitations on home equity plans that are subject to the requirements of 12 C.F.R. 1026.40 and certain ``higher-priced'' mortgage loans (HPMLs) that are subject to the requirements of 12 C.F.R. 1026.35. The regulation prohibits certain acts or practices in connection with credit secured by a consumer's principal dwelling.",763,0,train
do they end up together in no strings attached,"No Strings Attached (film) -- The end credits show an epilogue in which Alvin and Lucy are in a relationship, and are in a restaurant waiting for Adam to arrive to tell him. Adam's roommate (Jake Johnson) and Patrice are in a relationship and are shown meeting his two dads. Vanessa had told Adam that old people scare her and she is ridden with anxiety when she is trapped in an elevator full of senior citizens. Adam and Emma are seen kissing in the park. Sam and Shira are in a relationship, but he wants his freedom and isn't pleased when she reveals that she's already been seeing other men. Katie is having a baby and Emma is the delivering doctor. Guy lures a nervous-looking Sam into a hospital room. At last, Adam and Emma are shown peacefully sleeping together.",764,1,train
is washington dc a state in the united states,"Washington, D.C. -- The signing of the Residence Act on July 16, 1790, approved the creation of a capital district located along the Potomac River on the country's East Coast. The U.S. Constitution provided for a federal district under the exclusive jurisdiction of the Congress and the District is therefore not a part of any state. The states of Maryland and Virginia each donated land to form the federal district, which included the pre-existing settlements of Georgetown and Alexandria. Named in honor of President George Washington, the City of Washington was founded in 1791 to serve as the new national capital. In 1846, Congress returned the land originally ceded by Virginia; in 1871, it created a single municipal government for the remaining portion of the District.",765,0,train
does a female blackbird have a yellow beak,"Common blackbird -- The common blackbird of the nominate subspecies T. m. merula is 23.5 to 29 centimetres (9.25 to 11.4 in) in length, has a long tail, and weighs 80--125 grams (2.8 to 4.4 oz). The adult male has glossy black plumage, blackish-brown legs, a yellow eye-ring and an orange-yellow bill. The bill darkens somewhat in winter. The adult female is sooty-brown with a dull yellowish-brownish bill, a brownish-white throat and some weak mottling on the breast. The juvenile is similar to the female, but has pale spots on the upperparts, and the very young juvenile also has a speckled breast. Young birds vary in the shade of brown, with darker birds presumably males. The first year male resembles the adult male, but has a dark bill and weaker eye ring, and its folded wing is brown, rather than black like the body plumage.",766,0,train
is a stop sign considered a traffic control device,"Stop sign -- Stop sign placement can pose an additional challenge to users. There is a tradeoff between the salient visual cues provided by increased limit line setback, and the crucial time that is lost in approaching the intersection from behind that line; being closer can provide a few additional seconds requisite for safe transit. However, common creeping into the intersection past the limit line causes drivers to lose the invaluable perspective of the visual acuity of lateral motion, crippling them to the more dangerous SAVT. This makes it very difficult to estimate the movement of oncoming traffic. As intersections are not engineered to be used this way, the traffic flow ideals have broken down when drivers consistently choose this method as the safer alternative. Stop signs are accompanied with a limit line, which has a mandatory setback distance which is often not less than 15 feet. While it may be negligence per se to prematurely pass the stop limit line, drivers may be unfairly denied sufficient time gap or opportunity to enter otherwise because of the through-traffic flow and speed; the inherent problem with this traffic control device. While stop signs are a relatively inexpensive method of traffic management, they can be expensive from perspective of the damage they cause users. Pricey but safer traffic signals, roundabouts, and traffic circles are alternatively used where traffic flow dictates it is inappropriate to use a stop sign. It is just as crucial for law enforcement to regulate traffic through-speed that is above the assured clear distance ahead ahead as it is to cite stop sign runners for this device to be a viable option.",767,1,train
is switched at birth based on a real story,"Switched at Birth (film) -- Switched at Birth is a 1991 American television film directed by Waris Hussein. It is based on the true story of Kimberly Mays and Arlena Twigg, babies switched soon after birth in a Florida hospital in 1978.",768,1,train
does alternative minimum tax apply to capital gains,"Alternative minimum tax -- Each year a taxpayer must calculate and then pay the greater of an alternative minimum tax (AMT) or regular tax. Effectively for high income earners who mitigate their tax position from the day-to-day income tax, an end-of-year consolidation of all taxable income is requested and submitted. This is then paid in arrears (from the normal payroll income tax) less any allowable deductions. For many taxpayers, the effective marginal tax rates are 0% (exemption), 26% (low bracket), 28% (high bracket), 32.5% (low bracket with exemption phase out), and 35% (high bracket with exemption phase out), with increasing taxable income as modified for AMT. As with regular federal income tax, rates and exemptions vary by filing status. The lower rate and the exemption are phased out above certain income levels at 25% of AMT income. A lower rate applies on long-term capital gains (and qualifying dividends).",769,1,train
is ryne sandberg in the hall of fame,"Ryne Sandberg -- Sandberg established himself as a perennial All-Star and Gold Glove candidate, making 10 consecutive All-Star appearances and winning nine consecutive Gold Gloves from 1983 to 1991. His career .989 fielding percentage was a major-league record at second base when he retired in 1997. Sandberg was elected to the National Baseball Hall of Fame in January 2005; he was formally inducted in ceremonies on July 31, 2005. He resigned from his managerial duties for the Phillies on June 26, 2015, and was succeeded by Pete Mackanin.",770,1,train
is there a season six of once upon a time,"Once Upon a Time (season 6) -- The sixth season of the American ABC fantasy-drama Once Upon a Time was ordered on March 3, 2016. It debuted on September 25, 2016, and concluded on May 14, 2017. In January 2017, it was stated that the sixth season would end the main storyline, and for a seventh season, the series would be softly rebooted with a new storyline.",771,1,train
are they making a season seven of once upon a time,"Once Upon a Time (season 7) -- The seventh season of the American ABC fantasy-drama Once Upon a Time was ordered on May 11, 2017. It will consist of 22 episodes, airing on Fridays, having premiered on October 6, 2017.",772,1,train
are there parables in the gospel of john,"Parables of Jesus -- The Parables of Jesus can be found in all the gospels, except for John, and in some of the non-canonical gospels, but are located mainly within the three Synoptic Gospels. They represent a main part of the teachings of Jesus, forming approximately one third of his recorded teachings. Christians place high emphasis on these parables; since they are the purported words of Jesus, they are believed to be what the Father has taught, indicated by John 8:28 and 14:10.",773,0,train
will breast cyst go away on their own,"Breast cyst -- Breast cysts can be painful and may be worrisome but are generally benign. They are most common in pre-menopausal women in their 30s or 40s. They usually disappear after menopause, but may persist or reappear when using hormone therapy. They are also common in adolescents. Breast cysts can be part of fibrocystic disease. The pain and swelling is usually worse in the second half of the menstrual cycle or during pregnancy.",774,1,train
does xbox 360 games play on xbox one,"List of backward compatible games for Xbox One -- The Xbox One gaming console has received updates from Microsoft since its launch in 2013 that enable it to play select games from its two predecessor consoles, Xbox and Xbox 360. On June 15, 2015, backward compatibility with supported Xbox 360 games became available to eligible Xbox Preview program users with a beta update to the Xbox One system software. The dashboard update containing backward compatibility was released publicly on November 12, 2015. On October 24, 2017, another such update added games from the original Xbox library. The following is a list of all backward compatible games on Xbox One under this functionality.",775,1,train
does the m train go to broadway junction,"Broadway Junction (New York City Subway) -- Broadway Junction is a New York City Subway station complex shared by the elevated BMT Canarsie Line and BMT Jamaica Line, and the underground IND Fulton Street Line. It was also served by trains of the Fulton Street Elevated until that line closed in 1956. It is located roughly at the intersection of Broadway, Fulton Street and Van Sinderen Avenue at the border of Bedford-Stuyvesant and East New York, Brooklyn. The complex is served by the A, J, and L trains at all times; the C train at all times except late nights; and the Z train during rush hours in the peak direction only.",776,0,train
is mary a witch in mary and the witchs flower,"Mary and the Witch's Flower -- The film tells a story of a girl named Mary Smith who finds ``fly-by-night'', a mysterious flower that can give her the power to become a witch for only one night. The film was released in Japan on 8 July 2017. In the English-language version of the film, which was concurrently released with a subtitled version in the United States on 19 January 2018, the film features the voices of Ruby Barnhill, Kate Winslet and Jim Broadbent.",777,1,train
are ipv6 unique local unicast addresses routable within and outside an organization,"Unique local address -- A unique local address (ULA) is an Internet Protocol version 6 (IPv6) address in the address range fc00::/7. Its purpose in IPv6 is analogous to IPv4 addressing in private networks. Unique local addresses may be used freely, without centralized registration, inside a single site or organization or spanning a limited number of sites or organizations. They are routable only within the scope of such private networks, but not in the global IPv6 Internet.",778,0,train
are there any hells angels in sons of anarchy,"David Labrava -- David M. Labrava (born October 19, 1962) is an actor, writer, tattoo artist, member of the Hells Angels and motorcycle enthusiast best known for playing Happy in the FX series Sons of Anarchy.",779,1,train
is cognitive therapy the same as cognitive behavioural therapy,"Cognitive therapy -- Cognitive therapy (CT) is a type of psychotherapy developed by American psychiatrist Aaron T. Beck. CT is one of the therapeutic approaches within the larger group of cognitive behavioral therapies (CBT) and was first expounded by Beck in the 1960s. Cognitive therapy is based on the cognitive model, which states that thoughts, feelings and behavior are all connected, and that individuals can move toward overcoming difficulties and meeting their goals by identifying and changing unhelpful or inaccurate thinking, problematic behavior, and distressing emotional responses. This involves the individual working collaboratively with the therapist to develop skills for testing and modifying beliefs, identifying distorted thinking, relating to others in different ways, and changing behaviors. A tailored cognitive case conceptualization is developed by the cognitive therapist as a roadmap to understand the individual's internal reality, select appropriate interventions and identify areas of distress.",780,0,train
can a catholic receive communion in an episcopal church,"Closed communion -- The Catholic Church distinguishes between Churches whose celebration of the Eucharist, as well as holy orders, it recognizes as valid and those of other Christian communities. In the case that it is impossible to approach a Catholic minister, that it is a case of real need or spiritual benefit,and that the danger of error or indifferentism is avoided, the Catholic Church permits its faithful to receive Communion in Orthodox Churches, although Orthodox Churches do not honour this and only permit Orthodox Christians to receive Communion in Orthodox Churches. The Catholic Church does not ordinarily allow a Catholic to receive communion in a Protestant church, since it does not consider Protestant ministers to be priests ordained by bishops in a line of valid succession from the apostles, although Lutherans, Moravians, and Anglicans teach that they ordain their clergy in lines of apostolic succession. It applies this rule also to the Anglican Communion, pursuant to Apostolicae curae, a position that the Church of England disputed in Saepius officio.",781,0,train
is need for speed the run open world,"Need for Speed: The Run -- Need for Speed: The Run is a racing video game, the eighteenth title in the long-running Need for Speed franchise, and developed by Canadian EA subsidiary EA Black Box and published by Electronic Arts. The Wii and 3DS versions were developed by Firebrand Games, the team behind Undercover and Nitro (both DS versions). It was released in North America on November 15, 2011 and November 18, 2011 in Europe.",782,1,train
do any of the originals die in the originals,"Original Vampires (The Vampire Diaries) -- He is killed in the season 3 episode ``The Murder of One'', when Stefan, Elena and Matt kill him, thinking that it will kill all of the Originals due to their ``linked'' status. However, Klaus manages to force Bonnie into unlinking the siblings moments before Finn is killed. It is revealed through Finn's death that when an Original dies, all vampires of his or her bloodline die as well.",783,1,train
when does ned stark die in the show,"Ned Stark -- In a review of the Game of Thrones TV episode ``Baelor'', James Poniewozik wrote in Time that ``the execution of Eddard Stark is crucial to the story and its themes and everything that follows, but it's also a meta-message to the reader: don't take anything for granted here.'' James Hibberd of Entertainment Weekly stated that tricking the audience into thinking Ned is the hero and then killing him makes the series' story better. Writing that ``the big twist here isn't that Ned Stark dies, but who the true protagonists of Game of Thrones are,'' Hibberd pointed out that the series' focus proves to be the ``new generation'' of leaders, in particular the Stark children but also Daenerys and even Tyrion. He noted:",784,1,train
will there be a 4th hunger games movie,"The Hunger Games: Mockingjay – Part 2 -- The Hunger Games: Mockingjay -- Part 2 is a 2015 American dystopian science fiction adventure film directed by Francis Lawrence, with a screenplay by Peter Craig and Danny Strong. It is the fourth and final installment in The Hunger Games film series, and the second of two films based on the novel Mockingjay, the final book in The Hunger Games trilogy by Suzanne Collins. Produced by Nina Jacobson and Jon Kilik, and distributed by Lionsgate, the film features an ensemble cast that includes Jennifer Lawrence, Josh Hutcherson, Liam Hemsworth, Woody Harrelson, Elizabeth Banks, Julianne Moore, Philip Seymour Hoffman, and Donald Sutherland. Hoffman died in February 2014, making Mockingjay -- Part 2 his final film role. Principal photography on both parts of the film began on September 23, 2013 in Atlanta, before moving to Paris for two weeks of back-to-back filming and officially concluding on June 20, 2014, in Berlin and at Babelsberg Studios, Germany.",785,1,train
