question,passage,idx,label,ds_type
if a table contains a primary key there can be no duplicate records in a table,"Table (database) -- In terms of the relational model of databases, a table can be considered a convenient representation of a relation, but the two are not strictly equivalent. For instance, an SQL table can potentially contain duplicate rows, whereas a true relation cannot contain duplicate tuples. Similarly, representation as a table implies a particular ordering to the rows and columns, whereas a relation is explicitly unordered. However, the database system does not guarantee any ordering of the rows unless an ORDER BY clause is specified in the SELECT statement that queries the table.",247,0,train
have the arkansas razorbacks ever won a national championship in football,"Arkansas Razorbacks -- On December 4, 2012, the University of Arkansas named Bret Bielema the football team's new head coach. The position was previously held by John L. Smith, who served as the interim coach while UofA found a replacement for Bobby Petrino after Petrino was released from his duties with cause on April 10, 2012. Petrino followed the ten season tenure of Houston Nutt. The team plays its home games either at Donald W. Reynolds Razorback Stadium, located on the University of Arkansas campus in Fayetteville, or at War Memorial Stadium, located in Little Rock. In 1964, the Razorbacks were the only team to go through the regular season and a bowl game undefeated, and they were awarded the Football Writers Association of America National Championship. The 1969 team, led by quarterback Bill Montgomery, challenged the Texas Longhorns for a national championship in the Game of the Century.",248,1,train
do litigants on people's court get paid,"The People's Court -- The losing party does not actually need to pay the judgment, as such. Instead (as is stated in the disclaimer at the end of each show), both parties are paid from a fund (set up by Ralph Edwards-Stu Billett Productions). This fund was based on the amount of the lawsuit claim, but an exact formula was not stated. The fund was to be first divided equally, then any monetary judgment ordered was subtracted from the loser's half (and presumably both halves in the case of cross judgments). Each litigant received at least what remained of their half in shows concluding with that disclaimer.",249,1,train
is zip code the same as post code,"Postal code -- A postal code (also known locally in various English-speaking countries throughout the world as a postcode, post code, Eircode, PIN Code or ZIP Code) is a series of letters or digits or both, sometimes including spaces or punctuation, included in a postal address for the purpose of sorting mail.",250,1,train
did we leave the lunar rover on the moon,"Lunar Roving Vehicle -- The LRV was transported to the Moon on the Apollo Lunar Module (LM) and, once unpacked on the surface, could carry one or two astronauts, their equipment, and lunar samples. The three LRVs remain on the Moon.",251,1,train
is it legal to drink beer while driving in texas,Alcohol laws of Texas -- All previously opened containers of alcoholic beverages must be stored and transported in a vehicle's trunk or other storage to which the driver and or any passengers do not have access.,252,0,train
does blow drying your hair kill lice eggs,"Treatment of human head lice -- A standard home blow dryer will kill 96.7% of eggs with proper technique. To be effective, the blow dryer must be used repeatedly (every 1 to 7 days since eggs hatch in 7 to 10 days) until the natural life cycle of the lice is over (about 4 weeks).",253,1,train
was the movie the guardian based on a true story,"The Guardian (2006 film) -- The Guardian is a 2006 action-adventure drama film directed by Andrew Davis. The film stars Kevin Costner, Ashton Kutcher and Melissa Sagemiller. The film's title is introduced by a mythic tale: people lost at sea often claim they feel a presence lifting them to the surface, breathing life into their bodies while they are waiting for help to arrive. They call this presence ``The Guardian''. The setting for the film is the United States Coast Guard and their Aviation Survival Technician (AST) program. The Guardian was released on September 29, 2006.",254,0,train
did lebanon ever qualify for the world cup,"Lebanon national football team -- In 2000 they hosted the AFC Asian Cup in which they finished in last place in their respective group. They have only participated once at the Asian Games, in 1998, and where knocked out at the second round. They are regular participants at the WAFF Championship, a football competition consisting mainly of West Asian countries and territories. Lebanon also participates in the UAFA Arab Nations Cup and hosted the 1963 tournament, in which they finished in third place, and claimed fourth place at the 1964 and 1966 editions. They claimed third place as hosts at the UAFA Pan Arab Games tournaments in both 1957 and 1997 and managed fourth place at the 1961 edition. The team has never qualified for the FIFA World Cup. Lebanon reached its highest ever FIFA ranking at 79th in June 2018.",255,0,train
is monaco a country in its own right,"Monaco -- Monaco (/ˈmɒnəkoʊ/ ( listen); French pronunciation: ​(mɔnako)), officially the Principality of Monaco (French: Principauté de Monaco), is a sovereign city-state, country and microstate on the French Riviera in Western Europe. France borders the country on three sides while the other side borders the Mediterranean Sea. Monaco has an area of 2.02 km (0.78 sq mi) and a population of about 38,400, according to the last census of 2016. With 19,009 inhabitants per km2, it is the second-smallest and most densely populated sovereign state in the world. Monaco has a land border of 5.47 km (3.40 mi), a coastline of 3.83 km (2.38 mi), and a width that varies between 1,700 and 349 m (1,859 and 382 yd). The highest point in the country is a narrow pathway named Chemin des Révoires on the slopes of Mont Agel, in the Les Révoires Ward, which is 161 metres (528 feet) above sea level. Monaco's most populous Quartier is Monte Carlo and the most populous Ward is Larvotto/Bas Moulins. Through land reclamation, Monaco's land mass has expanded by 20 percent; in 2005, it had an area of only 1.974 km (0.762 sq mi). Monaco is known as a playground for the rich and famous, due to its tax laws. In 2014, it was noted about 30% of the population was made up of millionaires, more than in Zürich or Geneva.",256,1,train
is the movie the mission based on a true story,"The Mission (1986 film) -- The Mission is based on events surrounding the Treaty of Madrid in 1750, in which Spain ceded part of Jesuit Paraguay to Portugal. A significant subtext is the impending suppression of the Jesuits, of which Father Gabriel is warned by the film's narrator, Cardinal Altamirano, who was once himself a Jesuit. Altamirano, speaking in hindsight in 1758, corresponds to the actual Andalusian Jesuit Father Luis Altamirano, who was sent by Jesuit Superior General Ignacio Visconti to Paraguay in 1752 to transfer territory from Spain to Portugal. He oversaw the transfer of seven missions south and east of the Río Uruguay, that had been settled by Guaraní and Jesuits in the 17th century. As compensation, Spain promised each mission 4,000 pesos, or fewer than 1 peso for each of the circa 30,000 Guaraní of the seven missions, while the cultivated lands, livestock, and buildings were estimated to be worth 7--16 million pesos. The film's climax is the Guaraní War of 1754--1756, during which historical Guaraní defended their homes against Spanish-Portuguese forces implementing the Treaty of Madrid. For the film, a re-creation was made of one of the seven missions, São Miguel das Missões.",257,1,train
do you have to win a tennis set by 2,"Tennis scoring system -- A tennis match is composed of points, games, and sets. A set consists of a number of games (a minimum of six), which in turn each consist of points. A set is won by the first side to win 6 games, with a margin of at least 2 games over the other side (e.g. 6--3 or 7--5). There is usually a tie-break if the set is tied at six games per player. A match is won when a player or a doubles team wins the majority of prescribed sets. Matches employ either a best-of-three or best-of-five set format. The best-of-five set format is typically only played in the men's singles or doubles matches at Grand Slam and Davis Cup matches.",258,1,train
did china ever qualify for fifa world cup,"China at the FIFA World Cup -- The China national team was founded in 1924 and joined FIFA in 1931--1958, and then from 1979. China first entered World Cup qualification in 1957 in an attempt to qualify for the 1958 FIFA World Cup. China failed to score a goal in their maiden World Cup appearance in 2002. However, qualifying for the tournament has been considered the greatest accomplishment in China's football history. As football is widely followed in China, triumph by the national team is considered to be a source of national pride. Around 300 million people tuned into broadcasts of China's World Cup 2002 matches, with 170 million new television sets being purchased by citizens in order to watch their nation's first World Cup appearance. The team is colloquially referred to as Team China (中国队), the National Team (国家队) or Guozu (国足, lit. ``national foot'' also meaning national football).",259,1,train
are england in the world cup semi finals,"England at the FIFA World Cup -- England played against Sweden in their quarter-final at Cosmos Arena, Samara on 7 July 2018. They won the match 2--0, with defender Harry Maguire scoring his first England goal, a header scored from a corner, and Dele Alli a second header from close range. This would send them through to their third World Cup semi-final and their first since 1990, and third overall. The team played Croatia in the semi-final, resulting in a 2--1 loss after extra time. England would later finish fourth in the competition, the best result since 1990. England would lose again to Belgium in the 3rd place playoff, thanks to goals from Thomas Meunier and Eden Hazard, despite a Eric Dier shot being cleared off the line by Toby Alderweireld.",260,1,train
are green beans the same as french beans,"Green bean -- Green beans are the unripe, young fruit and protective pods of various cultivars of the common bean (Phaseolus vulgaris). Immature or young pods of the runner bean (Phaseolus coccineus), yardlong bean (Vigna unguiculata subsp. sesquipedalis), and hyacinth bean (Lablab purpureus) are used in a similar way. Green beans are known by many common names, including French beans, string beans, snap beans, and snaps.",261,1,train
does all of japan have the same time zone,"Japan Standard Time -- Japan Standard Time or JST (日本標準時, Nihon Hyōjunji, or 中央標準時 Chūō Hyōjunji) is the standard timezone in Japan, 9 hours ahead of UTC (i.e. it is UTC+09:00). There is no daylight saving time, though its introduction has been debated several times. During World War II, it was often called Tokyo Standard Time.",262,1,train
is spiderman homecoming a sequel to the amazing spider man,"Spider-Man: Homecoming -- Spider-Man: Homecoming is a 2017 American superhero film based on the Marvel Comics character Spider-Man, co-produced by Columbia Pictures and Marvel Studios, and distributed by Sony Pictures Releasing. It is the second Spider-Man film reboot and the sixteenth film in the Marvel Cinematic Universe (MCU). The film is directed by Jon Watts, from a screenplay by the writing teams of Jonathan Goldstein and John Francis Daley, Watts and Christopher Ford, and Chris McKenna and Erik Sommers. Tom Holland stars as Peter Parker / Spider-Man, alongside Michael Keaton, Jon Favreau, Zendaya, Donald Glover, Tyne Daly, Marisa Tomei, and Robert Downey Jr. In Spider-Man: Homecoming, Peter Parker tries to balance high school life with being Spider-Man, while facing the Vulture.",263,0,train
does the entire blastocyst develop into a fetus,"Blastocyst -- The blastocyst is a structure formed in the early development of mammals. It possesses an inner cell mass (ICM) which subsequently forms the embryo. The outer layer of the blastocyst consists of cells collectively called the trophoblast. This layer surrounds the inner cell mass and a fluid-filled cavity known as the blastocoele. The trophoblast gives rise to the placenta. The name ``blastocyst'' arises from the Greek βλαστός blastos (``a sprout'') and κύστις kystis (``bladder, capsule'').",264,0,train
can someone be both left and right handed,"Ambidexterity -- Ambidexterity is the state of being equally adapted in the use of both the left and the right hand. When referring to objects, the concept indicates that the object is equally suitable for right-handed and left-handed people. When referring to humans, it indicates that a person has no marked preference for the use of the right or left hand.",265,1,train
is there a season 4 of phryne fisher,"Miss Fisher's Murder Mysteries -- Miss Fisher's Murder Mysteries is an Australian drama television series. It was first broadcast on ABC on 24 February 2012. The series revolves around the personal and professional life of Phryne Fisher (Essie Davis), a glamorous private detective in 1920s Melbourne. Three series have been broadcast, beginning in 2012. Television stations in other nations have picked up the series, and Netflix has the series available in many countries.",266,0,train
can you go out with a wild card in uno,"Uno (card game) -- The first player to get rid of their last card (``going out'') wins the hand and scores points for the cards held by the other players. Number cards count their face value, all action cards count 20, and Wild and Wild Draw Four cards count 50. If a Draw Two or Wild Draw Four card is played to go out, the next player in sequence must draw the appropriate number of cards before the score is tallied.",267,1,train
can a us citizen hold a foreign title,"Title of Nobility Clause -- The Title of Nobility Clause is a provision in Article I, Section 9, Clause 8 of the United States Constitution, that prohibits the federal government from granting titles of nobility, and restricts members of the government from receiving gifts, emoluments, offices or titles from foreign states without the consent of the United States Congress. Also known as the Emoluments Clause, it was designed to shield the republican character of the United States against so-called ``corrupting foreign influences''. This shield is reinforced by the corresponding prohibition on state titles of nobility in Article I, Section 10, and more generally by the Republican Guarantee Clause in Article IV, Section 4.",268,1,train
can a social security number have 8 digits,"Social Security number -- The Social Security number is a nine-digit number in the format ``AAA-GG-SSSS''. The number is divided into three parts: the first three digits, known as the area number because they were formerly assigned by geographical region; the middle two digits, known as the group number; and the final four digits, known as the serial number.",269,0,train
has anyone won all four grand slam in one year,"Grand Slam (tennis) -- In terms of the current four majors, the first to win all four in a single year was Don Budge, who completed the feat in 1938. To date, 17 players have completed a Grand Slam, though only six in the most prestigious singles titles. Of these players, three have won multiple majors: Rod Laver accomplished the feat twice in men's singles; Margaret Court accomplished the feat three times, in two different disciplines -- once in women's singles and twice in mixed doubles; and Esther Vergeer completed a grand slam twice in Women's wheelchair doubles.",270,1,train
can you download itv hub on xbox 360,"ITV Hub -- ITV Hub was launched for Xbox One on Friday 10 February 2017, this was made possible by a new Universal Windows Platform app which integrates with Windows 10 and Xbox One. The STV Player app run by STV, who currently hold the ITV licence for Scotland, has been launched on Xbox 360. The STV Player app contains much of the content found on ITV Player and requires a Scottish postcode to be entered prior to use.",271,1,train
does a trapezoid have one set of parallel lines,"Trapezoid -- In Euclidean geometry, a convex quadrilateral with at least one pair of parallel sides is referred to as a trapezoid (/ˈtræpəzɔɪd/) in American and Canadian English but as a trapezium (/trəˈpiːziəm/) in English outside North America. The parallel sides are called the bases of the trapezoid and the other two sides are called the legs or the lateral sides (if they are not parallel; otherwise there are two pairs of bases). A scalene trapezoid is a trapezoid with no sides of equal measure, in contrast to the special cases below.",272,1,train
does prime minister have to be an mp,"Prime Minister of the United Kingdom -- The office is not established by any statute or constitutional document but exists only by long-established convention, which stipulates that the monarch must appoint as Prime Minister the person most likely to command the confidence of the House of Commons; this individual is typically the leader of the political party or coalition of parties that holds the largest number of seats in that chamber. The position of Prime Minister was not created; it evolved slowly and erratically over three hundred years due to numerous acts of Parliament, political developments, and accidents of history. The office is therefore best understood from a historical perspective. The origins of the position are found in constitutional changes that occurred during the Revolutionary Settlement (1688--1720) and the resulting shift of political power from the Sovereign to Parliament. Although the Sovereign was not stripped of the ancient prerogative powers and legally remained the head of government, politically it gradually became necessary for him or her to govern through a Prime Minister who could command a majority in Parliament.",273,0,train
can i use my veteran id to get on base,Veteran identification card -- The VIC differs from a Veteran Health Identification Card (VHIC) or a DoD Uniformed Services or retiree ID Card as it cannot be used as proof of eligibility for any federal benefits and does not grant access to military installations.,274,0,train
is it illegal to be in possession of alcohol under 21,"Minor in Possession -- In the United States, a Minor in Possession, or a MIP, (also referred to as a PAULA, Possession of Alcohol Under the Legal Age) is illegal, typically a misdemeanor. In California, depending on the county in which the person is charged, the crime may also be charged as an infraction. Anyone who is under the age of 21 and possesses alcohol in the United States, with the exception of special circumstances, is violating the law of the state.",275,1,train
is the 2017 chevy cruze front wheel drive,"Chevrolet Cruze -- The production Cruze had standard front-wheel drive, with all-wheel drive optional. Chevrolet pursued a marketing strategy that positioned the high-riding Cruze as a light-duty sport utility vehicle (SUV). This contrasted with Suzuki's approach with the Ignis marketed as a conventional passenger model. From 2003, Suzuki of Europe began manufacturing the Cruze as the Suzuki Ignis--representing a facelift of the original Ignis, but only for European markets.",276,1,train
can there be a beach on a lake,"Beach -- Although the seashore is most commonly associated with the word beach, beaches are also found by lakes and alongside large rivers.",277,1,train
does puerto rico have to follow us laws,"Implications of Puerto Rico's current political status -- Constitutionally, Puerto Rico is subject to the Congress' plenary powers under the territorial clause of Article IV, sec. 3, of the U.S. Constitution. U.S. federal law applies to Puerto Rico, even though Puerto Rico is not a state of the American Union and their residents have no voting representation in the U.S. Congress. Because of the establishment of the Federal Relations Act of 1950, all federal laws that are ``not locally inapplicable'' are automatically the law of the land in Puerto Rico. Following the 1950 and 1952 legislation, only two district court decisions have held that a particular federal law, which does not specifically exclude or treat Puerto Rico differently, is inapplicable to Puerto Rico. The more recent decision was vacated on appeal. Efrén Rivera Ramos, Dean and Professor of Law at the University of Puerto Rico School of Law, clarified the meaning of plenary powers, explaining, ``The government of a state derives its powers from the people of the state, whereas the government of a territory owes its existence wholly to the United States. The Court thus seems to equate plenary power to exclusive power. The U.S. government could exert over the territory power that it could not exercise over the states.'' Ramos quotes Justice Harlan, writing in Grafton v. United States, 206 U.S. 333 (1907), ``The jurisdiction and authority of the United States over that territory (referring to the Philippines) and its inhabitants, for all legitimate purposes of government is paramount,''. Ramos then goes on to argue ``This power, however, is not absolute, for it is restrained by some then-undefined fundamental rights possessed by anyone subject to the authority of the U.S. government.''",278,1,train
does every us citizen have a social security number,"Social Security number -- Social Security was originally a universal tax, but when Medicare was passed in 1965, objecting religious groups in existence prior to 1951 were allowed to opt out of the system. Because of this, not every American is part of the Social Security program, and not everyone has a number. However, a social security number is required for parents to claim their children as dependents for federal income tax purposes, and the Internal Revenue Service requires all corporations to obtain SSNs (or alternative identifying numbers) from their employees, as described below. The Old Order Amish have fought to prevent universal Social Security by overturning rules such as a requirement to provide a Social Security number for a hunting license.",279,0,train
can anything be faster than the speed of light,"Faster-than-light -- Faster-than-light (also superluminal or FTL) communication and travel refer to the propagation of information or matter faster than the speed of light. The special theory of relativity implies that only particles with zero rest mass may travel at the speed of light. Tachyons, particles whose speed exceeds that of light, have been hypothesized but the existence of such particles would violate causality and the consensus of physicists is that such particles cannot exist.",280,0,train
is there going to be a mr robot season 4,"Mr. Robot -- The pilot premiered on multiple online and video on demand services on May 27, 2015. The first season premiered on USA Network on June 24, 2015, and the second on July 13, 2016. The 10-episode third season premiered on October 11, 2017. In December 2017, Mr. Robot was renewed for a fourth season.",281,1,train
is it possible for an element to have different types of atoms,"Isotope -- The number of protons within the atom's nucleus is called atomic number and is equal to the number of electrons in the neutral (non-ionized) atom. Each atomic number identifies a specific element, but not the isotope; an atom of a given element may have a wide range in its number of neutrons. The number of nucleons (both protons and neutrons) in the nucleus is the atom's mass number, and each isotope of a given element has a different mass number.",282,1,train
is a cougar and a mountain lion the same thing,"Cougar -- The cougar (Puma concolor), also commonly known as the puma, mountain lion, panther, or catamount, is a large felid of the subfamily Felinae native to the Americas. Its range, from the Canadian Yukon to the southern Andes of South America, is the widest of any large wild terrestrial mammal in the Western Hemisphere. An adaptable, generalist species, the cougar is found in most American habitat types. It is the biggest cat in North America, and the second-heaviest cat in the New World after the jaguar. Secretive and largely solitary by nature, the cougar is properly considered both nocturnal and crepuscular, although daytime sightings do occur. The cougar is more closely related to smaller felines, including the domestic cat (subfamily Felinae), than to any species of subfamily Pantherinae, of which only the jaguar is native to the Americas.",283,1,train
does jimmy o die in sons of anarchy,"List of Sons of Anarchy characters -- James O'Phelan (Titus Welliver), better known as ``Jimmy O.,'' is the leader of the Real IRA group who sells guns to SAMCRO. Jimmy O. makes his first appearance in Season 2 to personally rectify the Hayes' betrayal of SAMCRO, since the Real IRA has long been dependent on the Sons Of Anarchy's Belfast chapter. Jimmy is generally regarded as Chibs Telford's archenemy. When the real IRA have proof of him going behind their backs, he takes Jax's son, Abel, to exchange for a safe passage back to the US. After a long hunt and search, SAMCRO finds out the Russians are hiding him. SAMCRO makes a deal to hand Jimmy over to them. When Agent Stahl gets custody of Jimmy O from SAMCRO, Chief Unser pulls them over with a ruse about Jimmy's members waiting ahead in a road block for them. With Stahl's other agents gone, Chibs & a few other members of SAMCRO show up by bus. Chibs pulls Jimmy O out of the car and slices his mouth, (in the same manner as Jimmy did him years before, scarring Chibs) and then stabs him to death.",284,1,train
